BATCH,,201205,B,860.0000,
INVOICE,IN,,13010036,,05/01/2012,430.0000,"Invoice-Private",,05/01/2012,05/10/2012,,13015658MO,-6521.0000,,,,,,,,,,
TRANSACTION,3260,010310130,1,27.0000,27.00,"Monthly Cable: Dudgeon, Ruth",,,,,,,,,,,,,,,
TRANSACTION,3039,010310130,31,13.0000,403.00,"Credit for Private Care DailyDiscount: Dudgeon, Ruth",,,,,,,,,,,,,,,
INVOICE,CM,,13010036,,05/01/2012,430,"Invoice-Private",,05/01/2012,05/10/2012,,13015658MO,-6521.0000,,,,,,,,,,
TRANSACTION,3260,010310130,1,27,27,"Credit for Monthly Cable: Dudgeon, Ruth",,,,,,,,,,,,,,,
TRANSACTION,3039,010310130,31,13,403,"Private Care DailyDiscount: Dudgeon, Ruth",,,,,,,,,,,,,,,
