BATCH,,201709,B,7460.3000,
INVOICE,IN,,11010546,,09/21/2017,7460.3000,"MoveIn-Olejniczak. Grace",,09/21/2017,09/21/2017,,11016966,7460.3000,,,,,,,,,,
TRANSACTION,3010,010007110,10,105.0000,1050,"G.Olejniczak: Basic Service Fee - Studio: Olejniczak. Grace",,,,,,,,,,,,,,,
TRANSACTION,3260,010007110,1,26.3000,26.3,"Monthly Cable: Olejniczak. Grace",,,,,,,,,,,,,,,
TRANSACTION,3216,010007110,1,3192.0000,3192,"Community Fee: Olejniczak. Grace",,,,,,,,,,,,,,,
TRANSACTION,3216,010007110,1,3192.0000,3192,"Monthly Deferral Charge: Olejniczak. Grace",,,,,,,,,,,,,,,
