BATCH,,201302,B,2823.0000,
INVOICE,IN,,15010191,,02/22/2013,2823.0000,"MoveIn-Johnson. Elaine",,02/22/2013,02/22/2013,,15014735,6382.0000,,,,,,,,,,
TRANSACTION,3010,010212150,7,96.0000,672,"Basic Service Fee- One Bedroom Premium: Johnson. Elaine",,,,,,,,,,,,,,,
TRANSACTION,3017,010212150,7,18.0000,126,"Resident Care - Level 1: Johnson. Elaine",,,,,,,,,,,,,,,
TRANSACTION,3260,010212150,1,25.0000,25,"Monthly Cable: Johnson. Elaine",,,,,,,,,,,,,,,
TRANSACTION,3216,010212150,1,2000.0000,2000,"New Resident Fee: Johnson. Elaine",,,,,,,,,,,,,,,
