BATCH,,201209,B,1850.0000,
INVOICE,IN,,10910245,,09/01/2012,925.0000,"Invoice-Private",,09/01/2012,09/10/2012,,10914827MO,209.0000,,,,,,,,,,
TRANSACTION,3260,010305109,1,25.0000,25.00,"Monthly Cable: Scott, Charles",,,,,,,,,,,,,,,
TRANSACTION,3320,010305109,30,30.0000,900.00,"Credit for Limited Term Discount: Scott, Charles",,,,,,,,,,,,,,,
INVOICE,CM,,10910245,,09/01/2012,925,"Invoice-Private",,09/01/2012,09/10/2012,,10914827MO,209.0000,,,,,,,,,,
TRANSACTION,3260,010305109,1,25,25,"Credit for Monthly Cable: Scott, Charles",,,,,,,,,,,,,,,
TRANSACTION,3320,010305109,30,30,900,"Limited Term Discount: Scott, Charles",,,,,,,,,,,,,,,
