BATCH,,201108,B,3984.0000,
INVOICE,IN,,21210167,,08/05/2011,3984.0000,"MoveIn-Cross. Rosemarie",,08/05/2011,08/05/2011,,21212012,3984.0000,,,,,,,,,,
TRANSACTION,3010,010208212,27,88.0000,2376,"R.Cross: Studio Deluxe: Cross. Rosemarie",,,,,,,,,,,,,,,
TRANSACTION,3017,010208212,27,21.0000,567,"R.Cross: Resident Care - Level 2: Cross. Rosemarie",,,,,,,,,,,,,,,
TRANSACTION,3260,010208212,1,41.0000,41,"Monthly Cable: Cross. Rosemarie",,,,,,,,,,,,,,,
TRANSACTION,3216,010208212,1,1000.0000,1000,"New Resident Fee: Cross. Rosemarie",,,,,,,,,,,,,,,
