BATCH,,201107,B,1620.0000,
INVOICE,IN,,14210166,,07/01/2011,810.0000,"Invoice-Private",,07/01/2011,07/10/2011,,14213512MO,-2876.0000,,,,,,,,,,
TRANSACTION,3260,010309142,1,35.0000,35.00,"Monthly Cable: Maxwell, Clayton",,,,,,,,,,,,,,,
TRANSACTION,3320,010309142,31,25.0000,775.00,"Credit for Limited Term Discount: Maxwell, Clayton",,,,,,,,,,,,,,,
INVOICE,CM,,14210166,,07/01/2011,810,"Invoice-Private",,07/01/2011,07/10/2011,,14213512MO,-2876.0000,,,,,,,,,,
TRANSACTION,3260,010309142,1,35,35,"Credit for Monthly Cable: Maxwell, Clayton",,,,,,,,,,,,,,,
TRANSACTION,3320,010309142,31,25,775,"Limited Term Discount: Maxwell, Clayton",,,,,,,,,,,,,,,
