BATCH,,201302,B,162.0000,
INVOICE,IN,,01610272,,02/01/2013,81.0000,"Invoice-Private",,02/01/2013,02/10/2013,,01616190MO,-2155.0000,,,,,,,,,,
TRANSACTION,3320,010202016,28,2.0000,56.00,"Credit for Limited Term Discount: Gluck, Leland",,,,,,,,,,,,,,,
TRANSACTION,3260,010202016,1,25.0000,25.00,"Monthly Cable: Gluck, Leland",,,,,,,,,,,,,,,
INVOICE,CM,,01610272,,02/01/2013,81,"Invoice-Private",,02/01/2013,02/10/2013,,01616190MO,-2155.0000,,,,,,,,,,
TRANSACTION,3320,010202016,28,2,56,"Limited Term Discount: Gluck, Leland",,,,,,,,,,,,,,,
TRANSACTION,3260,010202016,1,25,25,"Credit for Monthly Cable: Gluck, Leland",,,,,,,,,,,,,,,
