BATCH,,201206,B,170.0000,
INVOICE,IN,,01610284,,06/01/2012,85.0000,"Invoice-Private",,06/01/2012,06/10/2012,,01615849MO,-2435.0000,,,,,,,,,,
TRANSACTION,3320,010202016,30,2.0000,60.00,"Credit for Limited Term Discount: Henslee, Bethel",,,,,,,,,,,,,,,
TRANSACTION,3260,010202016,1,25.0000,25.00,"Monthly Cable: Henslee, Bethel",,,,,,,,,,,,,,,
INVOICE,CM,,01610284,,06/01/2012,85,"Invoice-Private",,06/01/2012,06/10/2012,,01615849MO,-2435.0000,,,,,,,,,,
TRANSACTION,3320,010202016,30,2,60,"Limited Term Discount: Henslee, Bethel",,,,,,,,,,,,,,,
TRANSACTION,3260,010202016,1,25,25,"Credit for Monthly Cable: Henslee, Bethel",,,,,,,,,,,,,,,
