BATCH,,201205,B,860.0000,
INVOICE,IN,,01710123,,05/01/2012,430.0000,"Invoice-Private",,05/01/2012,05/10/2012,,01713573MO,-1509.0000,,,,,,,,,,
TRANSACTION,3260,010202017,1,27.0000,27.00,"Monthly Cable: Inman, Helen",,,,,,,,,,,,,,,
TRANSACTION,3320,010202017,31,13.0000,403.00,"Credit for Limited Term Discount: Inman, Helen",,,,,,,,,,,,,,,
INVOICE,CM,,01710123,,05/01/2012,430,"Invoice-Private",,05/01/2012,05/10/2012,,01713573MO,-1509.0000,,,,,,,,,,
TRANSACTION,3260,010202017,1,27,27,"Credit for Monthly Cable: Inman, Helen",,,,,,,,,,,,,,,
TRANSACTION,3320,010202017,31,13,403,"Limited Term Discount: Inman, Helen",,,,,,,,,,,,,,,
