BATCH,,201112,B,1290.0000,
INVOICE,IN,,02110169,,12/01/2011,645.0000,"Invoice-Private",,12/01/2011,12/10/2011,,02114776MO,0.0000,,,,,,,,,,
TRANSACTION,3260,010202021,1,25.0000,25.00,"Monthly Cable: James, Verda",,,,,,,,,,,,,,,
TRANSACTION,3320,010202021,31,20.0000,620.00,"Credit for Limited Term Discount: James, Verda",,,,,,,,,,,,,,,
INVOICE,CM,,02110169,,12/01/2011,645,"Invoice-Private",,12/01/2011,12/10/2011,,02114776MO,0.0000,,,,,,,,,,
TRANSACTION,3260,010202021,1,25,25,"Credit for Monthly Cable: James, Verda",,,,,,,,,,,,,,,
TRANSACTION,3320,010202021,31,20,620,"Limited Term Discount: James, Verda",,,,,,,,,,,,,,,
