BATCH,,201201,B,4799.0000,
INVOICE,IN,,53510207,,01/06/2012,4799.0000,"MoveIn-Guenther. Mary Belle",,01/06/2012,01/06/2012,,53514302,4799.0000,,,,,,,,,,
TRANSACTION,3010,010319535,26,99.0000,2574,"Basic Service Fee - One Bedroom: Guenther. Mary Belle",,,,,,,,,,,,,,,
TRANSACTION,3260,010319535,1,25.0000,25,"Monthly Cable: Guenther. Mary Belle",,,,,,,,,,,,,,,
TRANSACTION,3216,010319535,1,2000.0000,2000,"New Resident Fee: Guenther. Mary Belle",,,,,,,,,,,,,,,
TRANSACTION,3130,010319535,1,200.0000,200,"Pendant Fee: Guenther. Mary Belle",,,,,,,,,,,,,,,
