BATCH,,201208,B,3075.0000,
INVOICE,IN,,53510215,,08/22/2012,3075.0000,"MoveIn-Cornelius. Gertrude",,08/22/2012,08/22/2012,,53514819,6135.0000,,,,,,,,,,
TRANSACTION,3010,010319535,10,101.0000,1010,"Basic Service Fee - One Bedroom Del: Cornelius. Gertrude",,,,,,,,,,,,,,,
TRANSACTION,3260,010319535,1,30.0000,30,"Monthly Cable: Cornelius. Gertrude",,,,,,,,,,,,,,,
TRANSACTION,3216,010319535,1,2000.0000,2000,"New Resident Fee: Cornelius. Gertrude",,,,,,,,,,,,,,,
TRANSACTION,3130,010319535,1,35.0000,35,"Pendant Fee: Cornelius. Gertrude",,,,,,,,,,,,,,,
