BATCH,,201204,B,4893.0000,
INVOICE,IN,,53510213,,04/03/2012,4893.0000,"MoveIn-Martensen. Marilyn",,04/03/2012,04/03/2012,,53514512,4893.0000,,,,,,,,,,
TRANSACTION,3010,010319535,28,101.0000,2828,"Basic Service Fee - One Bedroom Del: Martensen. Marilyn",,,,,,,,,,,,,,,
TRANSACTION,3260,010319535,1,30.0000,30,"Monthly Cable: Martensen. Marilyn",,,,,,,,,,,,,,,
TRANSACTION,3216,010319535,1,2000.0000,2000,"New Resident Fee: Martensen. Marilyn",,,,,,,,,,,,,,,
TRANSACTION,3130,010319535,1,35.0000,35,"Pendant Fee: Martensen. Marilyn",,,,,,,,,,,,,,,
