BATCH,,201109,B,170.0000,
INVOICE,IN,,02010220,,09/01/2011,85.0000,"Invoice-Private",,09/01/2011,09/10/2011,,02014245MO,-3916.0000,,,,,,,,,,
TRANSACTION,3260,010202020,1,25.0000,25.00,"Monthly Cable: Jacobs, James E.",,,,,,,,,,,,,,,
TRANSACTION,3320,010202020,30,2.0000,60.00,"Credit for Limited Term Discount: Jacobs, James E.",,,,,,,,,,,,,,,
INVOICE,CM,,02010220,,09/01/2011,85,"Invoice-Private",,09/01/2011,09/10/2011,,02014245MO,-3916.0000,,,,,,,,,,
TRANSACTION,3260,010202020,1,25,25,"Credit for Monthly Cable: Jacobs, James E.",,,,,,,,,,,,,,,
TRANSACTION,3320,010202020,30,2,60,"Limited Term Discount: Jacobs, James E.",,,,,,,,,,,,,,,
