BATCH,,201205,B,3831.0000,
INVOICE,IN,,11110309,,05/18/2012,3831.0000,"MoveIn-Ockenfels. Fritz",,05/18/2012,05/18/2012,,11114814,7726.0000,,,,,,,,,,
TRANSACTION,3010,010107111,14,113.0000,1582,"F.Ockenfels: Basic Service Fee - One Bedroom: Ockenfels. Fritz",,,,,,,,,,,,,,,
TRANSACTION,3017,010107111,14,16.0000,224,"F.Ockenfels: Resident Care - Level 1: Ockenfels. Fritz",,,,,,,,,,,,,,,
TRANSACTION,3260,010107111,1,25.0000,25,"Monthly Cable: Ockenfels. Fritz",,,,,,,,,,,,,,,
TRANSACTION,3216,010107111,1,2000.0000,2000,"New Resident Fee: Ockenfels. Fritz",,,,,,,,,,,,,,,
