BATCH,,201302,B,1226.0000,
INVOICE,IN,,05310202,,02/01/2013,613.0000,"Invoice-Private",,02/01/2013,02/10/2013,,05314892MO,-4014.2000,,,,,,,,,,
TRANSACTION,3260,010101053,1,25.0000,25.00,"Monthly Cable: Key, Bob",,,,,,,,,,,,,,,
TRANSACTION,3320,010101053,28,21.0000,588.00,"Credit for Limited Term Discount: Key, Bob",,,,,,,,,,,,,,,
INVOICE,CM,,05310202,,02/01/2013,613,"Invoice-Private",,02/01/2013,02/10/2013,,05314892MO,-4014.2000,,,,,,,,,,
TRANSACTION,3260,010101053,1,25,25,"Credit for Monthly Cable: Key, Bob",,,,,,,,,,,,,,,
TRANSACTION,3320,010101053,28,21,588,"Limited Term Discount: Key, Bob",,,,,,,,,,,,,,,
