BATCH,,201207,B,2158.0000,
INVOICE,IN,,05310246,,07/01/2012,1079.0000,"Invoice-Private",,07/01/2012,07/10/2012,,05314604MO,-1074.1000,,,,,,,,,,
TRANSACTION,3260,010101053,1,25.0000,25.00,"Monthly Cable: Taylor, Diane",,,,,,,,,,,,,,,
TRANSACTION,3320,010101053,31,34.0000,1054.00,"Credit for Limited Term Discount: Taylor, Diane",,,,,,,,,,,,,,,
INVOICE,CM,,05310246,,07/01/2012,1079,"Invoice-Private",,07/01/2012,07/10/2012,,05314604MO,-1074.1000,,,,,,,,,,
TRANSACTION,3260,010101053,1,25,25,"Credit for Monthly Cable: Taylor, Diane",,,,,,,,,,,,,,,
TRANSACTION,3320,010101053,31,34,1054,"Limited Term Discount: Taylor, Diane",,,,,,,,,,,,,,,
