BATCH,,201206,B,170.0000,
INVOICE,IN,,05310209,,06/01/2012,85.0000,"Invoice-Private",,06/01/2012,06/10/2012,,05314549MO,-5255.6300,,,,,,,,,,
TRANSACTION,3260,010101053,1,25.0000,25.00,"Monthly Cable: Potter, Francis",,,,,,,,,,,,,,,
TRANSACTION,3320,010101053,30,2.0000,60.00,"Credit for Limited Term Discount: Potter, Francis",,,,,,,,,,,,,,,
INVOICE,CM,,05310209,,06/01/2012,85,"Invoice-Private",,06/01/2012,06/10/2012,,05314549MO,-5255.6300,,,,,,,,,,
TRANSACTION,3260,010101053,1,25,25,"Credit for Monthly Cable: Potter, Francis",,,,,,,,,,,,,,,
TRANSACTION,3320,010101053,30,2,60,"Limited Term Discount: Potter, Francis",,,,,,,,,,,,,,,
