BATCH,,201108,B,1786.0000,
INVOICE,IN,,05310158,,08/01/2011,893.0000,"Invoice-Private",,08/01/2011,08/10/2011,,05314158MO,-2991.7000,,,,,,,,,,
TRANSACTION,3260,010101053,1,25.0000,25.00,"Monthly Cable: Martin, Emma",,,,,,,,,,,,,,,
TRANSACTION,3320,010101053,31,28.0000,868.00,"Credit for Limited Term Discount: Martin, Emma",,,,,,,,,,,,,,,
INVOICE,CM,,05310158,,08/01/2011,893,"Invoice-Private",,08/01/2011,08/10/2011,,05314158MO,-2991.7000,,,,,,,,,,
TRANSACTION,3260,010101053,1,25,25,"Credit for Monthly Cable: Martin, Emma",,,,,,,,,,,,,,,
TRANSACTION,3320,010101053,31,28,868,"Limited Term Discount: Martin, Emma",,,,,,,,,,,,,,,
