BATCH,,201107,B,2375.0000,
INVOICE,IN,,17510254,,07/22/2011,2375.0000,"MoveIn-Phillips. JoAnne",,07/22/2011,07/22/2011,,17517153,5035.0000,,,,,,,,,,
TRANSACTION,3010,010202175,10,73.0000,730,"J.Phillips: Basic Service Fee - Studio Deluxe: Phillips. JoAnne",,,,,,,,,,,,,,,
TRANSACTION,3017,010202175,10,12.0000,120,"J.Phillips: Resident Care - Level 1: Phillips. JoAnne",,,,,,,,,,,,,,,
TRANSACTION,3260,010202175,1,25.0000,25,"Monthly Cable: Phillips. JoAnne",,,,,,,,,,,,,,,
TRANSACTION,3216,010202175,1,1500.0000,1500,"New Resident Fee: Phillips. JoAnne",,,,,,,,,,,,,,,
