BATCH,,201203,B,1701.0000,
INVOICE,IN,,17510272,,03/30/2012,1701.0000,"MoveIn-Taylor. Harrell",,03/30/2012,03/30/2012,,17517494,4366.0000,,,,,,,,,,
TRANSACTION,3010,010202175,2,76.0000,152,"H.Taylor: Basic Service Fee - Studio Deluxe: Taylor. Harrell",,,,,,,,,,,,,,,
TRANSACTION,3017,010202175,2,12.0000,24,"H.Taylor: Resident Care - Level 1: Taylor. Harrell",,,,,,,,,,,,,,,
TRANSACTION,3260,010202175,1,25.0000,25,"Monthly Cable: Taylor. Harrell",,,,,,,,,,,,,,,
TRANSACTION,3216,010202175,1,1500.0000,1500,"New Resident Fee: Taylor. Harrell",,,,,,,,,,,,,,,
