BATCH,,201105,B,3735.0000,
INVOICE,IN,,17510247,,05/06/2011,3735.0000,"MoveIn-Parsons. Zenobia",,05/06/2011,05/06/2011,,17517035,3735.0000,,,,,,,,,,
TRANSACTION,3010,010202175,26,73.0000,1898,"Z.Parsons: Basic Service Fee - Studio Deluxe: Parsons. Zenobia",,,,,,,,,,,,,,,
TRANSACTION,3017,010202175,26,12.0000,312,"Z.Parsons: Resident Care - Level 1: Parsons. Zenobia",,,,,,,,,,,,,,,
TRANSACTION,3260,010202175,1,25.0000,25,"Monthly Cable: Parsons. Zenobia",,,,,,,,,,,,,,,
TRANSACTION,3216,010202175,1,1500.0000,1500,"New Resident Fee: Parsons. Zenobia",,,,,,,,,,,,,,,
