BATCH,,201207,B,174.0000,
INVOICE,IN,,16010359,,07/01/2012,87.0000,"Invoice-Private",,07/01/2012,07/10/2012,,16015275MO,-4176.0000,,,,,,,,,,
TRANSACTION,3260,010107160,1,25.0000,25.00,"Monthly Cable: Temple, Winston",,,,,,,,,,,,,,,
TRANSACTION,3320,010107160,31,2.0000,62.00,"Credit for Limited Term Discount: Temple, Winston",,,,,,,,,,,,,,,
INVOICE,CM,,16010359,,07/01/2012,87,"Invoice-Private",,07/01/2012,07/10/2012,,16015275MO,-4176.0000,,,,,,,,,,
TRANSACTION,3260,010107160,1,25,25,"Credit for Monthly Cable: Temple, Winston",,,,,,,,,,,,,,,
TRANSACTION,3320,010107160,31,2,62,"Limited Term Discount: Temple, Winston",,,,,,,,,,,,,,,
