BATCH,,201301,B,1724.0000,
INVOICE,IN,,11210292,,01/01/2013,862.0000,"Invoice-Private",,01/01/2013,01/10/2013,,11216360MO,-2905.0000,,,,,,,,,,
TRANSACTION,3260,010310112,1,25.0000,25.00,"Monthly Cable: Dibert, William",,,,,,,,,,,,,,,
TRANSACTION,3320,010310112,31,27.0000,837.00,"Credit for Limited Term Discount: Dibert, William",,,,,,,,,,,,,,,
INVOICE,CM,,11210292,,01/01/2013,862,"Invoice-Private",,01/01/2013,01/10/2013,,11216360MO,-2905.0000,,,,,,,,,,
TRANSACTION,3260,010310112,1,25,25,"Credit for Monthly Cable: Dibert, William",,,,,,,,,,,,,,,
TRANSACTION,3320,010310112,31,27,837,"Limited Term Discount: Dibert, William",,,,,,,,,,,,,,,
