BATCH,,201108,B,1034.0000,
INVOICE,IN,,14510222,,08/01/2011,517.0000,"Invoice-Private",,08/01/2011,08/10/2011,,14515029MO,-2437.0000,,,,,,,,,,
TRANSACTION,3260,010308145,1,27.0000,27.00,"Monthly Cable: Houston, Andrew",,,,,,,,,,,,,,,
TRANSACTION,3130,010308145,1,25.0000,25.00,"Pendant Fee: Houston, Andrew",,,,,,,,,,,,,,,
TRANSACTION,3320,010308145,31,15.0000,465.00,"Credit for Limited Term Discount: Houston, Andrew",,,,,,,,,,,,,,,
INVOICE,CM,,14510222,,08/01/2011,517,"Invoice-Private",,08/01/2011,08/10/2011,,14515029MO,-2437.0000,,,,,,,,,,
TRANSACTION,3260,010308145,1,27,27,"Credit for Monthly Cable: Houston, Andrew",,,,,,,,,,,,,,,
TRANSACTION,3130,010308145,1,25,25,"Credit for Pendant Fee: Houston, Andrew",,,,,,,,,,,,,,,
TRANSACTION,3320,010308145,31,15,465,"Limited Term Discount: Houston, Andrew",,,,,,,,,,,,,,,
