BATCH,,201210,B,184.0000,
INVOICE,IN,,16710237,,10/01/2012,92.0000,"Invoice-Private",,10/01/2012,10/10/2012,,16713927MO,-3974.0000,,,,,,,,,,
TRANSACTION,3260,010211167,1,30.0000,30.00,"Monthly Cable: Pollak, Edward",,,,,,,,,,,,,,,
TRANSACTION,3320,010211167,31,2.0000,62.00,"Credit for Limited Term Discount: Pollak, Edward",,,,,,,,,,,,,,,
INVOICE,CM,,16710237,,10/01/2012,92,"Invoice-Private",,10/01/2012,10/10/2012,,16713927MO,-3974.0000,,,,,,,,,,
TRANSACTION,3260,010211167,1,30,30,"Credit for Monthly Cable: Pollak, Edward",,,,,,,,,,,,,,,
TRANSACTION,3320,010211167,31,2,62,"Limited Term Discount: Pollak, Edward",,,,,,,,,,,,,,,
