BATCH,,201108,B,73.6000,
INVOICE,IN,,16710213,,08/01/2011,36.8000,"Invoice-Private",,08/01/2011,08/10/2011,,16713490MO,-5589.8000,,,,,,,,,,
TRANSACTION,3260,010211167,1,30.0000,30.00,"Monthly Cable: Flyr, Charlotte",,,,,,,,,,,,,,,
TRANSACTION,3019,010211167,1,6.8000,6.80,"Additional Service Charge: Flyr, Charlotte",,,,,,,,,,,,,,,
INVOICE,CM,,16710213,,08/01/2011,36.8,"Invoice-Private",,08/01/2011,08/10/2011,,16713490MO,-5589.8000,,,,,,,,,,
TRANSACTION,3260,010211167,1,30,30,"Credit for Monthly Cable: Flyr, Charlotte",,,,,,,,,,,,,,,
TRANSACTION,3019,010211167,1,6.8,6.8,"Credit for Additional Service Charge: Flyr, Charlotte",,,,,,,,,,,,,,,
