BATCH,,201205,B,184.0000,
INVOICE,IN,,16710221,,05/01/2012,92.0000,"Invoice-Private",,05/01/2012,05/10/2012,,16713800MO,-6375.0000,,,,,,,,,,
TRANSACTION,3260,010211167,1,30.0000,30.00,"Monthly Cable: Klundt, Otto",,,,,,,,,,,,,,,
TRANSACTION,3320,010211167,31,2.0000,62.00,"Credit for Limited Term Discount: Klundt, Otto",,,,,,,,,,,,,,,
INVOICE,CM,,16710221,,05/01/2012,92,"Invoice-Private",,05/01/2012,05/10/2012,,16713800MO,-6375.0000,,,,,,,,,,
TRANSACTION,3260,010211167,1,30,30,"Credit for Monthly Cable: Klundt, Otto",,,,,,,,,,,,,,,
TRANSACTION,3320,010211167,31,2,62,"Limited Term Discount: Klundt, Otto",,,,,,,,,,,,,,,
