BATCH,,201212,B,184.0000,
INVOICE,IN,,16710234,,12/01/2012,92.0000,"Invoice-Private",,12/01/2012,12/10/2012,,16713966MO,-4962.0000,,,,,,,,,,
TRANSACTION,3260,010211167,1,30.0000,30.00,"Monthly Cable: Robotham, Dorothy",,,,,,,,,,,,,,,
TRANSACTION,3320,010211167,31,2.0000,62.00,"Credit for Limited Term Discount: Robotham, Dorothy",,,,,,,,,,,,,,,
INVOICE,CM,,16710234,,12/01/2012,92,"Invoice-Private",,12/01/2012,12/10/2012,,16713966MO,-4962.0000,,,,,,,,,,
TRANSACTION,3260,010211167,1,30,30,"Credit for Monthly Cable: Robotham, Dorothy",,,,,,,,,,,,,,,
TRANSACTION,3320,010211167,31,2,62,"Limited Term Discount: Robotham, Dorothy",,,,,,,,,,,,,,,
