BATCH,,201207,B,184.0000,
INVOICE,IN,,16710199,,07/01/2012,92.0000,"Invoice-Private",,07/01/2012,07/10/2012,,16713854MO,-3895.0000,,,,,,,,,,
TRANSACTION,3260,010211167,1,30.0000,30.00,"Monthly Cable: Hladky, JoAnn",,,,,,,,,,,,,,,
TRANSACTION,3320,010211167,31,2.0000,62.00,"Credit for Limited Term Discount: Hladky, JoAnn",,,,,,,,,,,,,,,
INVOICE,CM,,16710199,,07/01/2012,92,"Invoice-Private",,07/01/2012,07/10/2012,,16713854MO,-3895.0000,,,,,,,,,,
TRANSACTION,3260,010211167,1,30,30,"Credit for Monthly Cable: Hladky, JoAnn",,,,,,,,,,,,,,,
TRANSACTION,3320,010211167,31,2,62,"Limited Term Discount: Hladky, JoAnn",,,,,,,,,,,,,,,
