BATCH,,201108,B,184.0000,
INVOICE,IN,,16710193,,08/01/2011,92.0000,"Invoice-Private",,08/01/2011,08/10/2011,,16713489MO,-5738.0000,,,,,,,,,,
TRANSACTION,3260,010211167,1,30.0000,30.00,"Monthly Cable: Ponec, Robert",,,,,,,,,,,,,,,
TRANSACTION,3320,010211167,31,2.0000,62.00,"Credit for Limited Term Discount: Ponec, Robert",,,,,,,,,,,,,,,
INVOICE,CM,,16710193,,08/01/2011,92,"Invoice-Private",,08/01/2011,08/10/2011,,16713489MO,-5738.0000,,,,,,,,,,
TRANSACTION,3260,010211167,1,30,30,"Credit for Monthly Cable: Ponec, Robert",,,,,,,,,,,,,,,
TRANSACTION,3320,010211167,31,2,62,"Limited Term Discount: Ponec, Robert",,,,,,,,,,,,,,,
