BATCH,,201209,B,670.0000,
INVOICE,IN,,19610199,,09/01/2012,335.0000,"Invoice-Private",,09/01/2012,09/10/2012,,19613172MO,-3445.0000,,,,,,,,,,
TRANSACTION,3260,010315196,1,35.0000,35.00,"Monthly Cable: Sviland, Dale",,,,,,,,,,,,,,,
TRANSACTION,2094,010315196,30,10.0000,300.00,"CC Meals: Sviland, Dale",,,,,,,,,,,,,,,
INVOICE,CM,,19610199,,09/01/2012,335,"Invoice-Private",,09/01/2012,09/10/2012,,19613172MO,-3445.0000,,,,,,,,,,
TRANSACTION,3260,010315196,1,35,35,"Credit for Monthly Cable: Sviland, Dale",,,,,,,,,,,,,,,
TRANSACTION,2094,010315196,30,10,300,"Credit for CC Meals: Sviland, Dale",,,,,,,,,,,,,,,
