BATCH,,201305,B,690.0000,
INVOICE,IN,,19610116,,05/01/2013,345.0000,"Invoice-Private",,05/01/2013,05/10/2013,,19613476MO,-4172.0800,,,,,,,,,,
TRANSACTION,3260,010315196,1,35.0000,35.00,"Monthly Cable: Alperovitz, Lois",,,,,,,,,,,,,,,
TRANSACTION,2094,010315196,31,10.0000,310.00,"CC Meals: Alperovitz, Lois",,,,,,,,,,,,,,,
INVOICE,CM,,19610116,,05/01/2013,345,"Invoice-Private",,05/01/2013,05/10/2013,,19613476MO,-4172.0800,,,,,,,,,,
TRANSACTION,3260,010315196,1,35,35,"Credit for Monthly Cable: Alperovitz, Lois",,,,,,,,,,,,,,,
TRANSACTION,2094,010315196,31,10,310,"Credit for CC Meals: Alperovitz, Lois",,,,,,,,,,,,,,,
