BATCH,,201206,B,1520.0000,
INVOICE,IN,,06010223,,06/01/2012,760.0000,"Invoice-Private",,06/01/2012,06/10/2012,,06014368MO,-2251.0000,,,,,,,,,,
TRANSACTION,3320,010206060,30,24.0000,720.00,"Credit for Limited Term Discount: Nifong, Kathleen",,,,,,,,,,,,,,,
TRANSACTION,3260,010206060,1,40.0000,40.00,"Monthly Cable: Nifong, Kathleen",,,,,,,,,,,,,,,
INVOICE,CM,,06010223,,06/01/2012,760,"Invoice-Private",,06/01/2012,06/10/2012,,06014368MO,-2251.0000,,,,,,,,,,
TRANSACTION,3320,010206060,30,24,720,"Limited Term Discount: Nifong, Kathleen",,,,,,,,,,,,,,,
TRANSACTION,3260,010206060,1,40,40,"Credit for Monthly Cable: Nifong, Kathleen",,,,,,,,,,,,,,,
