BATCH,,201201,B,298.0000,
INVOICE,IN,,21010102,,01/01/2012,149.0000,"Invoice-Private",,01/01/2012,01/10/2012,,21013316MO,-3125.0000,,,,,,,,,,
TRANSACTION,3260,010216210,1,25.0000,25.00,"Monthly Cable: Pope, Ross",,,,,,,,,,,,,,,
TRANSACTION,3320,010216210,31,4.0000,124.00,"Credit for Limited Term Discount: Pope, Ross",,,,,,,,,,,,,,,
INVOICE,CM,,21010102,,01/01/2012,149,"Invoice-Private",,01/01/2012,01/10/2012,,21013316MO,-3125.0000,,,,,,,,,,
TRANSACTION,3260,010216210,1,25,25,"Credit for Monthly Cable: Pope, Ross",,,,,,,,,,,,,,,
TRANSACTION,3320,010216210,31,4,124,"Limited Term Discount: Pope, Ross",,,,,,,,,,,,,,,
