BATCH,,201205,B,1414.0000,
INVOICE,IN,,21010179,,05/01/2012,707.0000,"Invoice-Private",,05/01/2012,05/10/2012,,21013528MO,-5153.0000,,,,,,,,,,
TRANSACTION,3260,010216210,1,25.0000,25.00,"Monthly Cable: Evans, Elizabeth",,,,,,,,,,,,,,,
TRANSACTION,3320,010216210,31,22.0000,682.00,"Credit for Limited Term Discount: Evans, Elizabeth",,,,,,,,,,,,,,,
INVOICE,CM,,21010179,,05/01/2012,707,"Invoice-Private",,05/01/2012,05/10/2012,,21013528MO,-5153.0000,,,,,,,,,,
TRANSACTION,3260,010216210,1,25,25,"Credit for Monthly Cable: Evans, Elizabeth",,,,,,,,,,,,,,,
TRANSACTION,3320,010216210,31,22,682,"Limited Term Discount: Evans, Elizabeth",,,,,,,,,,,,,,,
