BATCH,,201203,B,1728.0000,
INVOICE,IN,,05210258,,03/01/2012,864.0000,"Invoice-Private",,03/01/2012,03/10/2012,,05214749MO,-797.0000,,,,,,,,,,
TRANSACTION,3260,010202052,1,27.0000,27.00,"Monthly Cable: Evans, Max",,,,,,,,,,,,,,,
TRANSACTION,3320,010202052,31,27.0000,837.00,"Credit for Limited Term Discount: Evans, Max",,,,,,,,,,,,,,,
INVOICE,CM,,05210258,,03/01/2012,864,"Invoice-Private",,03/01/2012,03/10/2012,,05214749MO,-797.0000,,,,,,,,,,
TRANSACTION,3260,010202052,1,27,27,"Credit for Monthly Cable: Evans, Max",,,,,,,,,,,,,,,
TRANSACTION,3320,010202052,31,27,837,"Limited Term Discount: Evans, Max",,,,,,,,,,,,,,,
