BATCH,,201308,B,90.0000,
INVOICE,IN,,01410098,,08/01/2013,45.0000,"Invoice-Private",,08/01/2013,08/10/2013,,01414771MO,-4816.0000,,,,,,,,,,
TRANSACTION,3228,010202014,1,20.0000,20.00,"Sharps Disposal: Graham, Aurthur",,,,,,,,,,,,,,,
TRANSACTION,3260,010202014,1,25.0000,25.00,"Monthly Cable: Graham, Aurthur",,,,,,,,,,,,,,,
INVOICE,CM,,01410098,,08/01/2013,45,"Invoice-Private",,08/01/2013,08/10/2013,,01414771MO,-4816.0000,,,,,,,,,,
TRANSACTION,3228,010202014,1,20,20,"Credit for Sharps Disposal: Graham, Aurthur",,,,,,,,,,,,,,,
TRANSACTION,3260,010202014,1,25,25,"Credit for Monthly Cable: Graham, Aurthur",,,,,,,,,,,,,,,
