BATCH,,201206,B,4227.0000,
INVOICE,IN,,16510311,,06/13/2012,4227.0000,"MoveIn-Jackson. Ella",,06/13/2012,06/13/2012,,16514285,3727.0000,,,,,,,,,,
TRANSACTION,3010,010308165,18,122.0000,2196,"E.Jackson: Basic Service Fee - One Bedroom: Jackson. Ella",,,,,,,,,,,,,,,
TRANSACTION,3017,010308165,18,28.0000,504,"E.Jackson: Resident Care - Level 2: Jackson. Ella",,,,,,,,,,,,,,,
TRANSACTION,3260,010308165,1,27.0000,27,"Monthly Cable: Jackson. Ella",,,,,,,,,,,,,,,
TRANSACTION,3216,010308165,1,1500.0000,1500,"New Resident Fee: Jackson. Ella",,,,,,,,,,,,,,,
