BATCH,,201203,B,204.0000,
INVOICE,IN,,1180749,,03/01/2012,102.0000,"Invoice-Private",,03/01/2012,03/10/2012,,11815182MO,-3841.0000,,,,,,,,,,
TRANSACTION,3260,010310118,1,40.0000,40.00,"Monthly Cable: McKinney, Mary",,,,,,,,,,,,,,,
TRANSACTION,3320,010310118,31,2.0000,62.00,"Credit for Limited Term Discount: McKinney, Mary",,,,,,,,,,,,,,,
INVOICE,CM,,1180749,,03/01/2012,102,"Invoice-Private",,03/01/2012,03/10/2012,,11815182MO,-3841.0000,,,,,,,,,,
TRANSACTION,3260,010310118,1,40,40,"Credit for Monthly Cable: McKinney, Mary",,,,,,,,,,,,,,,
TRANSACTION,3320,010310118,31,2,62,"Limited Term Discount: McKinney, Mary",,,,,,,,,,,,,,,
