BATCH,,201201,B,4050.0000,
INVOICE,IN,,19810300,,01/13/2012,4050.0000,"MoveIn-Willis. Helen",,01/13/2012,01/13/2012,,19816931,4050.0000,,,,,,,,,,
TRANSACTION,3010,010112198,19,47.0000,893,"Basic Service Fee- Comp 1BR AL B: Willis. Helen",,,,,,,,,,,,,,,
TRANSACTION,3017,010112198,19,33.0000,627,"Swan Personal Care - L1: Willis. Helen",,,,,,,,,,,,,,,
TRANSACTION,3260,010112198,1,30.0000,30,"Monthly Cable: Willis. Helen",,,,,,,,,,,,,,,
TRANSACTION,3216,010112198,1,2500.0000,2500,"New Resident Fee: Willis. Helen",,,,,,,,,,,,,,,
