BATCH,,201212,B,174.0000,
INVOICE,IN,,15510185,,12/01/2012,87.0000,"Invoice-Private",,12/01/2012,12/10/2012,,15515525MO,-2506.0000,,,,,,,,,,
TRANSACTION,3260,010310155,1,25.0000,25.00,"Monthly Cable: Kaufman, Helen",,,,,,,,,,,,,,,
TRANSACTION,3320,010310155,31,2.0000,62.00,"Credit for Limited Term Discount: Kaufman, Helen",,,,,,,,,,,,,,,
INVOICE,CM,,15510185,,12/01/2012,87,"Invoice-Private",,12/01/2012,12/10/2012,,15515525MO,-2506.0000,,,,,,,,,,
TRANSACTION,3260,010310155,1,25,25,"Credit for Monthly Cable: Kaufman, Helen",,,,,,,,,,,,,,,
TRANSACTION,3320,010310155,31,2,62,"Limited Term Discount: Kaufman, Helen",,,,,,,,,,,,,,,
