BATCH,,201203,B,1280.0000,
INVOICE,IN,,07010176,,03/01/2012,640.0000,"Invoice-Private",,03/01/2012,03/10/2012,,07014261MO,-6926.6600,,,,,,,,,,
TRANSACTION,3260,010305070,1,20.0000,20.00,"Monthly Cable: Stebbins, Helen",,,,,,,,,,,,,,,
TRANSACTION,3320,010305070,31,20.0000,620.00,"Credit for Limited Term Discount: Stebbins, Helen",,,,,,,,,,,,,,,
INVOICE,CM,,07010176,,03/01/2012,640,"Invoice-Private",,03/01/2012,03/10/2012,,07014261MO,-6926.6600,,,,,,,,,,
TRANSACTION,3260,010305070,1,20,20,"Credit for Monthly Cable: Stebbins, Helen",,,,,,,,,,,,,,,
TRANSACTION,3320,010305070,31,20,620,"Limited Term Discount: Stebbins, Helen",,,,,,,,,,,,,,,
