BATCH,,201208,B,988.0000,
INVOICE,IN,,01210243,,08/01/2012,494.0000,"Invoice-Private",,08/01/2012,08/10/2012,,01214037MO,-4053.4900,,,,,,,,,,
TRANSACTION,3260,010103012,1,29.0000,29.00,"Monthly Cable: Lloyd, Bill",,,,,,,,,,,,,,,
TRANSACTION,3320,010103012,31,15.0000,465.00,"Credit for Limited Term Discount: Lloyd, Bill",,,,,,,,,,,,,,,
INVOICE,CM,,01210243,,08/01/2012,494,"Invoice-Private",,08/01/2012,08/10/2012,,01214037MO,-4053.4900,,,,,,,,,,
TRANSACTION,3260,010103012,1,29,29,"Credit for Monthly Cable: Lloyd, Bill",,,,,,,,,,,,,,,
TRANSACTION,3320,010103012,31,15,465,"Limited Term Discount: Lloyd, Bill",,,,,,,,,,,,,,,
