BATCH,,201208,B,110.0000,
INVOICE,IN,,11010354,,08/01/2012,55.0000,"Invoice-Private",,08/01/2012,08/10/2012,,11014946MO,-1630.0000,,,,,,,,,,
TRANSACTION,3260,010107110,1,25.0000,25.00,"Monthly Cable: Paquette, Wilfred",,,,,,,,,,,,,,,
TRANSACTION,3130,010107110,1,30.0000,30.00,"Pendant Fee: Paquette, Wilfred",,,,,,,,,,,,,,,
INVOICE,CM,,11010354,,08/01/2012,55,"Invoice-Private",,08/01/2012,08/10/2012,,11014946MO,-1630.0000,,,,,,,,,,
TRANSACTION,3260,010107110,1,25,25,"Credit for Monthly Cable: Paquette, Wilfred",,,,,,,,,,,,,,,
TRANSACTION,3130,010107110,1,30,30,"Credit for Pendant Fee: Paquette, Wilfred",,,,,,,,,,,,,,,
