BATCH,,201302,B,1628.0000,
INVOICE,IN,,14610252,,02/01/2013,814.0000,"Invoice-Private",,02/01/2013,02/10/2013,,14614791MO,-5144.0000,,,,,,,,,,
TRANSACTION,3260,010309146,1,30.0000,30.00,"Monthly Cable: Ellars, Marian",,,,,,,,,,,,,,,
TRANSACTION,3320,010309146,28,28.0000,784.00,"Credit for Limited Term Discount: Ellars, Marian",,,,,,,,,,,,,,,
INVOICE,CM,,14610252,,02/01/2013,814,"Invoice-Private",,02/01/2013,02/10/2013,,14614791MO,-5144.0000,,,,,,,,,,
TRANSACTION,3260,010309146,1,30,30,"Credit for Monthly Cable: Ellars, Marian",,,,,,,,,,,,,,,
TRANSACTION,3320,010309146,28,28,784,"Limited Term Discount: Ellars, Marian",,,,,,,,,,,,,,,
