BATCH,,201107,B,1046.0000,
INVOICE,IN,,04210194,,07/01/2011,523.0000,"Invoice-Private",,07/01/2011,07/10/2011,,04213717MO,-2937.0000,,,,,,,,,,
TRANSACTION,3260,010202042,1,27.0000,27.00,"Monthly Cable: Gregg, Odell",,,,,,,,,,,,,,,
TRANSACTION,3320,010202042,31,16.0000,496.00,"Credit for Limited Term Discount: Gregg, Odell",,,,,,,,,,,,,,,
INVOICE,CM,,04210194,,07/01/2011,523,"Invoice-Private",,07/01/2011,07/10/2011,,04213717MO,-2937.0000,,,,,,,,,,
TRANSACTION,3260,010202042,1,27,27,"Credit for Monthly Cable: Gregg, Odell",,,,,,,,,,,,,,,
TRANSACTION,3320,010202042,31,16,496,"Limited Term Discount: Gregg, Odell",,,,,,,,,,,,,,,
