BATCH,,201204,B,1617.8000,
INVOICE,IN,,10010077,,04/01/2012,808.9000,"Invoice-Medicaid",,04/01/2012,04/10/2012,,10013858MO,-1847.6700,,,,,,,,,,
TRANSACTION,3260,010104100,1,25.0000,25.00,"Monthly Cable: Louis, Josephine R",,,,,,,,,,,,,,,
TRANSACTION,3012,010104100,1,783.9000,783.90,"State Medicaid: Louis, Josephine R",,,,,,,,,,,,,,,
INVOICE,CM,,10010077,,04/01/2012,808.9,"Invoice-Medicaid",,04/01/2012,04/10/2012,,10013858MO,-1847.6700,,,,,,,,,,
TRANSACTION,3260,010104100,1,25,25,"Credit for Monthly Cable: Louis, Josephine R",,,,,,,,,,,,,,,
TRANSACTION,3012,010104100,1,783.9,783.9,"Credit for State Medicaid: Louis, Josephine R",,,,,,,,,,,,,,,
