BATCH,,201805,B,13825.0000,
INVOICE,IN,,34900188,,05/01/2018,13825.0000,"MoveIn-Peterson. Marilyn",,05/01/2018,05/01/2018,,34912148,13825.0000,,,,,,,,,,
TRANSACTION,3010,070027349,1,4600.0000,4600,"MC Studio: Peterson. Marilyn",,,,,,,,,,,,,,,
TRANSACTION,3216,070027349,1,4600.0000,4600,"CommunityFee: Peterson. Marilyn",,,,,,,,,,,,,,,
TRANSACTION,3260,070027349,1,25.0000,25,"Monthly Cable: Peterson. Marilyn",,,,,,,,,,,,,,,
TRANSACTION,3216,070027349,1,4600.0000,4600,"Monthly Deferral Charge: Peterson. Marilyn",,,,,,,,,,,,,,,
