BATCH,,201205,B,194.0000,
INVOICE,IN,,1510524,,05/01/2012,97.0000,"Invoice-Private",,05/01/2012,05/10/2012,,15113944MO,-4812.0000,,,,,,,,,,
TRANSACTION,3260,010212151,1,35.0000,35.00,"Monthly Cable: Hoffert, Amos",,,,,,,,,,,,,,,
TRANSACTION,3320,010212151,31,2.0000,62.00,"Credit for Limited Term Discount: Hoffert, Amos",,,,,,,,,,,,,,,
INVOICE,CM,,1510524,,05/01/2012,97,"Invoice-Private",,05/01/2012,05/10/2012,,15113944MO,-4812.0000,,,,,,,,,,
TRANSACTION,3260,010212151,1,35,35,"Credit for Monthly Cable: Hoffert, Amos",,,,,,,,,,,,,,,
TRANSACTION,3320,010212151,31,2,62,"Limited Term Discount: Hoffert, Amos",,,,,,,,,,,,,,,
