BATCH,,201203,B,1170.0000,
INVOICE,IN,,01710145,,03/31/2012,1170.0000,"MoveIn-Graves. Lee",,03/31/2012,03/31/2012,,01713579,5492.0000,,,,,,,,,,
TRANSACTION,3010,010202017,1,112.0000,112,"L.Graves: Basic Service Fee - One Bedroom: Graves. Lee",,,,,,,,,,,,,,,
TRANSACTION,3017,010202017,1,31.0000,31,"L.Graves: Resident Care - Level 2: Graves. Lee",,,,,,,,,,,,,,,
TRANSACTION,3260,010202017,1,27.0000,27,"Monthly Cable: Graves. Lee",,,,,,,,,,,,,,,
TRANSACTION,3216,010202017,1,1000.0000,1000,"New Resident Fee: Graves. Lee",,,,,,,,,,,,,,,
