BATCH,,201208,B,114.0000,
INVOICE,IN,,03110250,,08/01/2012,57.0000,"Invoice-Private",,08/01/2012,08/10/2012,,03116899MO,-4893.0000,,,,,,,,,,
TRANSACTION,3260,010202031,1,27.0000,27.00,"Monthly Cable: Thompson, Connie",,,,,,,,,,,,,,,
TRANSACTION,3130,010202031,1,30.0000,30.00,"Pendant Fee: Thompson, Connie",,,,,,,,,,,,,,,
INVOICE,CM,,03110250,,08/01/2012,57,"Invoice-Private",,08/01/2012,08/10/2012,,03116899MO,-4893.0000,,,,,,,,,,
TRANSACTION,3260,010202031,1,27,27,"Credit for Monthly Cable: Thompson, Connie",,,,,,,,,,,,,,,
TRANSACTION,3130,010202031,1,30,30,"Credit for Pendant Fee: Thompson, Connie",,,,,,,,,,,,,,,
