BATCH,,201305,B,2144.0000,
INVOICE,IN,,05210297,,05/31/2013,2144.0000,"MoveIn-Knippa. Freddie",,05/31/2013,05/31/2013,,05215348,5681.0000,,,,,,,,,,
TRANSACTION,3010,010202052,1,100.0000,100,"F.Knippa: Basic Service Fee - One Bedroom: Knippa. Freddie",,,,,,,,,,,,,,,
TRANSACTION,3017,010202052,1,17.0000,17,"F.Knippa: Resident Care - Level 1: Knippa. Freddie",,,,,,,,,,,,,,,
TRANSACTION,3260,010202052,1,27.0000,27,"Monthly Cable: Knippa. Freddie",,,,,,,,,,,,,,,
TRANSACTION,3216,010202052,1,2000.0000,2000,"New Resident Fee: Knippa. Freddie",,,,,,,,,,,,,,,
