BATCH,,201307,B,370.0000,
INVOICE,IN,,19810009,,07/01/2013,185.0000,"Invoice-Private",,07/01/2013,07/10/2013,,19818687MO,-1659.0000,,,,,,,,,,
TRANSACTION,3260,010112198,1,30.0000,30.00,"Monthly Cable: Saylor, Virginia",,,,,,,,,,,,,,,
TRANSACTION,3130,010112198,1,35.0000,35.00,"Pendant Fee: Saylor, Virginia",,,,,,,,,,,,,,,
TRANSACTION,3210,010112198,4,30.0000,120.00,"Personal Services: Saylor, Virginia",,,,,,,,,,,,,,,
INVOICE,CM,,19810009,,07/01/2013,185,"Invoice-Private",,07/01/2013,07/10/2013,,19818687MO,-1659.0000,,,,,,,,,,
TRANSACTION,3260,010112198,1,30,30,"Credit for Monthly Cable: Saylor, Virginia",,,,,,,,,,,,,,,
TRANSACTION,3130,010112198,1,35,35,"Credit for Pendant Fee: Saylor, Virginia",,,,,,,,,,,,,,,
TRANSACTION,3210,010112198,4,30,120,"Credit for Personal Services: Saylor, Virginia",,,,,,,,,,,,,,,
