BATCH,,201111,B,170.0000,
INVOICE,IN,,09010127,,11/01/2011,85.0000,"Invoice-Private",,11/01/2011,11/10/2011,,09014771MO,-3984.0000,,,,,,,,,,
TRANSACTION,3260,010104090,1,25.0000,25.00,"Monthly Cable: Jones, Jorene",,,,,,,,,,,,,,,
TRANSACTION,3320,010104090,30,2.0000,60.00,"Credit for Limited Term Discount: Jones, Jorene",,,,,,,,,,,,,,,
INVOICE,CM,,09010127,,11/01/2011,85,"Invoice-Private",,11/01/2011,11/10/2011,,09014771MO,-3984.0000,,,,,,,,,,
TRANSACTION,3260,010104090,1,25,25,"Credit for Monthly Cable: Jones, Jorene",,,,,,,,,,,,,,,
TRANSACTION,3320,010104090,30,2,60,"Limited Term Discount: Jones, Jorene",,,,,,,,,,,,,,,
