BATCH,,201208,B,184.0000,
INVOICE,IN,,15910198,,08/01/2012,92.0000,"Invoice-Private",,08/01/2012,08/10/2012,,15914854MO,-1519.0000,,,,,,,,,,
TRANSACTION,3260,010212159,1,30.0000,30.00,"Monthly Cable: Snyder, Rose",,,,,,,,,,,,,,,
TRANSACTION,3320,010212159,31,2.0000,62.00,"Credit for Limited Term Discount: Snyder, Rose",,,,,,,,,,,,,,,
INVOICE,CM,,15910198,,08/01/2012,92,"Invoice-Private",,08/01/2012,08/10/2012,,15914854MO,-1519.0000,,,,,,,,,,
TRANSACTION,3260,010212159,1,30,30,"Credit for Monthly Cable: Snyder, Rose",,,,,,,,,,,,,,,
TRANSACTION,3320,010212159,31,2,62,"Limited Term Discount: Snyder, Rose",,,,,,,,,,,,,,,
