BATCH,,201301,B,2778.0000,
INVOICE,IN,,02310209,,01/01/2013,1389.0000,"Invoice-Private",,01/01/2013,01/10/2013,,02315109MO,-3315.0000,,,,,,,,,,
TRANSACTION,3260,010202023,1,25.0000,25.00,"Monthly Cable: Hix, Elmer",,,,,,,,,,,,,,,
TRANSACTION,3320,010202023,31,44.0000,1364.00,"Credit for Limited Term Discount: Hix, Elmer",,,,,,,,,,,,,,,
INVOICE,CM,,02310209,,01/01/2013,1389,"Invoice-Private",,01/01/2013,01/10/2013,,02315109MO,-3315.0000,,,,,,,,,,
TRANSACTION,3260,010202023,1,25,25,"Credit for Monthly Cable: Hix, Elmer",,,,,,,,,,,,,,,
TRANSACTION,3320,010202023,31,44,1364,"Limited Term Discount: Hix, Elmer",,,,,,,,,,,,,,,
