BATCH,,201211,B,2870.0000,
INVOICE,IN,,11110312,,11/01/2012,1435.0000,"Invoice-Private",,11/01/2012,11/10/2012,,11114962MO,1120.0000,,,,,,,,,,
TRANSACTION,3260,010107111,1,25.0000,25.00,"Monthly Cable: Dougherty, Charlene",,,,,,,,,,,,,,,
TRANSACTION,3320,010107111,30,47.0000,1410.00,"Credit for Limited Term Discount: Dougherty, Charlene",,,,,,,,,,,,,,,
INVOICE,CM,,11110312,,11/01/2012,1435,"Invoice-Private",,11/01/2012,11/10/2012,,11114962MO,1120.0000,,,,,,,,,,
TRANSACTION,3260,010107111,1,25,25,"Credit for Monthly Cable: Dougherty, Charlene",,,,,,,,,,,,,,,
TRANSACTION,3320,010107111,30,47,1410,"Limited Term Discount: Dougherty, Charlene",,,,,,,,,,,,,,,
