BATCH,,201111,B,2857.0000,
INVOICE,IN,,50510104,,11/19/2011,2857.0000,"MoveIn-McGlone. Mary",,11/19/2011,11/19/2011,,50511518,6323.0000,,,,,,,,,,
TRANSACTION,3010,010305505,12,96.0000,1152,"M.McGlone: Basic Service Fee - Studio Premium: McGlone. Mary",,,,,,,,,,,,,,,
TRANSACTION,3017,010305505,12,15.0000,180,"M.McGlone: Resident Care - Level 1: McGlone. Mary",,,,,,,,,,,,,,,
TRANSACTION,3216,010305505,1,1500.0000,1500,"New Resident Fee: McGlone. Mary",,,,,,,,,,,,,,,
TRANSACTION,3260,010305505,1,25.0000,25,"Monthly Cable: McGlone. Mary",,,,,,,,,,,,,,,
