BATCH,,201801,B,7192.6700,
INVOICE,IN,,35200232,,01/01/2018,7192.6700,"MoveIn-Chalkley. Elizabeth",,01/01/2018,01/01/2018,,35212017,11280.6700,,,,,,,,,,
TRANSACTION,3010,070029352,31,90.0000,2790,"One Bedroom: Chalkley. Elizabeth",,,,,,,,,,,,,,,
TRANSACTION,3017,070029352,31,56.0000,1736,"Resident Care - Level 4: Chalkley. Elizabeth",,,,,,,,,,,,,,,
TRANSACTION,3216,070029352,1,2000.0000,2000,"Community Fee: Chalkley. Elizabeth",,,,,,,,,,,,,,,
TRANSACTION,3216,070029352,1,666.6700,666.67,"Monthly Deferral Charge: Chalkley. Elizabeth",,,,,,,,,,,,,,,
