BATCH,,201112,B,174.0000,
INVOICE,IN,,0771140,,12/01/2011,87.0000,"Invoice-Private",,12/01/2011,12/10/2011,,07714083MO,-5463.0000,,,,,,,,,,
TRANSACTION,3260,010104077,1,25.0000,25.00,"Monthly Cable: Hess, Miriam",,,,,,,,,,,,,,,
TRANSACTION,3320,010104077,31,2.0000,62.00,"Credit for Limited Term Discount: Hess, Miriam",,,,,,,,,,,,,,,
INVOICE,CM,,0771140,,12/01/2011,87,"Invoice-Private",,12/01/2011,12/10/2011,,07714083MO,-5463.0000,,,,,,,,,,
TRANSACTION,3260,010104077,1,25,25,"Credit for Monthly Cable: Hess, Miriam",,,,,,,,,,,,,,,
TRANSACTION,3320,010104077,31,2,62,"Limited Term Discount: Hess, Miriam",,,,,,,,,,,,,,,
