BATCH,,201207,B,5195.0000,
INVOICE,IN,,02310226,,07/06/2012,5195.0000,"MoveIn-Waldorf. Betty",,07/06/2012,07/06/2012,,02314953,5195.0000,,,,,,,,,,
TRANSACTION,3010,010202023,26,95.0000,2470,"B.Waldorf: Basic Service Fee - Studio: Waldorf. Betty",,,,,,,,,,,,,,,
TRANSACTION,3260,010202023,1,25.0000,25,"Monthly Cable: Waldorf. Betty",,,,,,,,,,,,,,,
TRANSACTION,3216,010202023,1,2000.0000,2000,"New Resident Fee: Waldorf. Betty",,,,,,,,,,,,,,,
TRANSACTION,3213,010202023,1,700.0000,700,"Pet Fee: Waldorf. Betty",,,,,,,,,,,,,,,
