BATCH,,201302,B,2122.0000,
INVOICE,IN,,51710211,,02/01/2013,1061.0000,"Invoice-Private",,02/01/2013,02/10/2013,,51713199MO,-1719.2000,,,,,,,,,,
TRANSACTION,3260,010103517,1,25.0000,25.00,"Monthly Cable: Harbick, Herena",,,,,,,,,,,,,,,
TRANSACTION,3320,010103517,28,37.0000,1036.00,"Credit for Limited Term Discount: Harbick, Herena",,,,,,,,,,,,,,,
INVOICE,CM,,51710211,,02/01/2013,1061,"Invoice-Private",,02/01/2013,02/10/2013,,51713199MO,-1719.2000,,,,,,,,,,
TRANSACTION,3260,010103517,1,25,25,"Credit for Monthly Cable: Harbick, Herena",,,,,,,,,,,,,,,
TRANSACTION,3320,010103517,28,37,1036,"Limited Term Discount: Harbick, Herena",,,,,,,,,,,,,,,
