BATCH,,201201,B,824.0000,
INVOICE,IN,,19410226,,01/01/2012,412.0000,"Invoice-Private",,01/01/2012,01/10/2012,,19414127MO,-2710.0000,,,,,,,,,,
TRANSACTION,3260,010212194,1,40.0000,40.00,"Monthly Cable: Kunze, Bernice",,,,,,,,,,,,,,,
TRANSACTION,3320,010212194,31,12.0000,372.00,"Credit for Limited Term Discount: Kunze, Bernice",,,,,,,,,,,,,,,
INVOICE,CM,,19410226,,01/01/2012,412,"Invoice-Private",,01/01/2012,01/10/2012,,19414127MO,-2710.0000,,,,,,,,,,
TRANSACTION,3260,010212194,1,40,40,"Credit for Monthly Cable: Kunze, Bernice",,,,,,,,,,,,,,,
TRANSACTION,3320,010212194,31,12,372,"Limited Term Discount: Kunze, Bernice",,,,,,,,,,,,,,,
