BATCH,,201210,B,194.0000,
INVOICE,IN,,12110119,,10/01/2012,97.0000,"Invoice-Private",,10/01/2012,10/10/2012,,12115938MO,-3052.0000,,,,,,,,,,
TRANSACTION,3260,010309121,1,35.0000,35.00,"Monthly Cable: Nelson, Betty",,,,,,,,,,,,,,,
TRANSACTION,3320,010309121,31,2.0000,62.00,"Credit for Limited Term Discount: Nelson, Betty",,,,,,,,,,,,,,,
INVOICE,CM,,12110119,,10/01/2012,97,"Invoice-Private",,10/01/2012,10/10/2012,,12115938MO,-3052.0000,,,,,,,,,,
TRANSACTION,3260,010309121,1,35,35,"Credit for Monthly Cable: Nelson, Betty",,,,,,,,,,,,,,,
TRANSACTION,3320,010309121,31,2,62,"Limited Term Discount: Nelson, Betty",,,,,,,,,,,,,,,
