BATCH,,201111,B,650.0000,
INVOICE,IN,,04610165,,11/01/2011,325.0000,"Invoice-Private",,11/01/2011,11/10/2011,,04613436MO,-2379.0000,,,,,,,,,,
TRANSACTION,3260,010202046,1,25.0000,25.00,"Monthly Cable: Lewis, Margarete",,,,,,,,,,,,,,,
TRANSACTION,3320,010202046,30,10.0000,300.00,"Credit for Limited Term Discount: Lewis, Margarete",,,,,,,,,,,,,,,
INVOICE,CM,,04610165,,11/01/2011,325,"Invoice-Private",,11/01/2011,11/10/2011,,04613436MO,-2379.0000,,,,,,,,,,
TRANSACTION,3260,010202046,1,25,25,"Credit for Monthly Cable: Lewis, Margarete",,,,,,,,,,,,,,,
TRANSACTION,3320,010202046,30,10,300,"Limited Term Discount: Lewis, Margarete",,,,,,,,,,,,,,,
