BATCH,,201107,B,178.0000,
INVOICE,IN,,13210184,,07/01/2011,89.0000,"Invoice-Private",,07/01/2011,07/10/2011,,13214934MO,-3563.0000,,,,,,,,,,
TRANSACTION,3260,010308132,1,27.0000,27.00,"Monthly Cable: Dickey, Athleen",,,,,,,,,,,,,,,
TRANSACTION,3320,010308132,31,2.0000,62.00,"Credit for Limited Term Discount: Dickey, Athleen",,,,,,,,,,,,,,,
INVOICE,CM,,13210184,,07/01/2011,89,"Invoice-Private",,07/01/2011,07/10/2011,,13214934MO,-3563.0000,,,,,,,,,,
TRANSACTION,3260,010308132,1,27,27,"Credit for Monthly Cable: Dickey, Athleen",,,,,,,,,,,,,,,
TRANSACTION,3320,010308132,31,2,62,"Limited Term Discount: Dickey, Athleen",,,,,,,,,,,,,,,
