BATCH,,201212,B,2658.0000,
INVOICE,IN,,13210252,,12/01/2012,1329.0000,"Invoice-Private",,12/01/2012,12/10/2012,,13215690MO,-3499.0000,,,,,,,,,,
TRANSACTION,3260,010308132,1,27.0000,27.00,"Monthly Cable: Dalton, Heyward",,,,,,,,,,,,,,,
TRANSACTION,3320,010308132,31,42.0000,1302.00,"Credit for Limited Term Discount: Dalton, Heyward",,,,,,,,,,,,,,,
INVOICE,CM,,13210252,,12/01/2012,1329,"Invoice-Private",,12/01/2012,12/10/2012,,13215690MO,-3499.0000,,,,,,,,,,
TRANSACTION,3260,010308132,1,27,27,"Credit for Monthly Cable: Dalton, Heyward",,,,,,,,,,,,,,,
TRANSACTION,3320,010308132,31,42,1302,"Limited Term Discount: Dalton, Heyward",,,,,,,,,,,,,,,
