BATCH,,201210,B,5805.0000,
INVOICE,IN,,53310267,,10/12/2012,5805.0000,"MoveIn-Michels. Alvira",,10/12/2012,10/12/2012,,53314906,5805.0000,,,,,,,,,,
TRANSACTION,3010,010319533,20,115.0000,2300,"A.Michels: Basic Service Fee - One Bedroom: Michels. Alvira",,,,,,,,,,,,,,,
TRANSACTION,3017,010319533,20,74.0000,1480,"A.Michels: Resident Care - Level 6: Michels. Alvira",,,,,,,,,,,,,,,
TRANSACTION,3260,010319533,1,25.0000,25,"Monthly Cable: Michels. Alvira",,,,,,,,,,,,,,,
TRANSACTION,3216,010319533,1,2000.0000,2000,"New Resident Fee: Michels. Alvira",,,,,,,,,,,,,,,
