BATCH,,201105,B,5843.0000,
INVOICE,IN,,12110257,,05/04/2011,5843.0000,"MoveIn-cook. charles",,05/04/2011,05/04/2011,,12114902,5843.0000,,,,,,,,,,
TRANSACTION,3010,010309121,28,120.0000,3360,"Basic Service Fee- One Bedroom Prem: cook. charles",,,,,,,,,,,,,,,
TRANSACTION,3017,010309121,28,16.0000,448,"Resident Care - Level 1: cook. charles",,,,,,,,,,,,,,,
TRANSACTION,3260,010309121,1,35.0000,35,"Monthly Cable: cook. charles",,,,,,,,,,,,,,,
TRANSACTION,3216,010309121,1,2000.0000,2000,"New Resident Fee: cook. charles",,,,,,,,,,,,,,,
