BATCH,,201107,B,2592.0000,
INVOICE,IN,,18910155,,07/01/2011,1296.0000,"Invoice-Private",,07/01/2011,07/10/2011,,18914744MO,-3365.0000,,,,,,,,,,
TRANSACTION,3260,010315189,1,25.0000,25.00,"Monthly Cable: Snow, Wanda",,,,,,,,,,,,,,,
TRANSACTION,3241,010315189,31,10.0000,310.00,"HSG Meals: Snow, Wanda",,,,,,,,,,,,,,,
TRANSACTION,3320,010315189,31,31.0000,961.00,"Credit for Limited Term Discount: Snow, Wanda",,,,,,,,,,,,,,,
INVOICE,CM,,18910155,,07/01/2011,1296,"Invoice-Private",,07/01/2011,07/10/2011,,18914744MO,-3365.0000,,,,,,,,,,
TRANSACTION,3260,010315189,1,25,25,"Credit for Monthly Cable: Snow, Wanda",,,,,,,,,,,,,,,
TRANSACTION,3241,010315189,31,10,310,"Credit for HSG Meals: Snow, Wanda",,,,,,,,,,,,,,,
TRANSACTION,3320,010315189,31,31,961,"Limited Term Discount: Snow, Wanda",,,,,,,,,,,,,,,
