BATCH,,201307,B,670.0000,
INVOICE,IN,,18910336,,07/01/2013,335.0000,"Invoice-Private",,07/01/2013,07/10/2013,,18915899MO,-2442.0000,,,,,,,,,,
TRANSACTION,2094,010315189,31,10.0000,310.00,"CC Meals: Smith, Russell",,,,,,,,,,,,,,,
TRANSACTION,3260,010315189,1,25.0000,25.00,"Monthly Cable: Smith, Russell",,,,,,,,,,,,,,,
INVOICE,CM,,18910336,,07/01/2013,335,"Invoice-Private",,07/01/2013,07/10/2013,,18915899MO,-2442.0000,,,,,,,,,,
TRANSACTION,2094,010315189,31,10,310,"Credit for CC Meals: Smith, Russell",,,,,,,,,,,,,,,
TRANSACTION,3260,010315189,1,25,25,"Credit for Monthly Cable: Smith, Russell",,,,,,,,,,,,,,,
