BATCH,,201212,B,794.0000,
INVOICE,IN,,18910173,,12/01/2012,397.0000,"Invoice-Private",,12/01/2012,12/10/2012,,18915511MO,-3905.0000,,,,,,,,,,
TRANSACTION,3260,010315189,1,25.0000,25.00,"Monthly Cable: Hogoboom, Elsie",,,,,,,,,,,,,,,
TRANSACTION,2094,010315189,31,10.0000,310.00,"CC Meals: Hogoboom, Elsie",,,,,,,,,,,,,,,
TRANSACTION,3320,010315189,31,2.0000,62.00,"Credit for Limited Term Discount: Hogoboom, Elsie",,,,,,,,,,,,,,,
INVOICE,CM,,18910173,,12/01/2012,397,"Invoice-Private",,12/01/2012,12/10/2012,,18915511MO,-3905.0000,,,,,,,,,,
TRANSACTION,3260,010315189,1,25,25,"Credit for Monthly Cable: Hogoboom, Elsie",,,,,,,,,,,,,,,
TRANSACTION,2094,010315189,31,10,310,"Credit for CC Meals: Hogoboom, Elsie",,,,,,,,,,,,,,,
TRANSACTION,3320,010315189,31,2,62,"Limited Term Discount: Hogoboom, Elsie",,,,,,,,,,,,,,,
