BATCH,,201211,B,3110.0000,
INVOICE,IN,,18910280,,11/01/2012,1555.0000,"Invoice-Private",,11/01/2012,11/10/2012,,18915463MO,-3249.0000,,,,,,,,,,
TRANSACTION,3260,010315189,1,25.0000,25.00,"Monthly Cable: Jesson, Don",,,,,,,,,,,,,,,
TRANSACTION,2094,010315189,30,10.0000,300.00,"CC Meals: Jesson, Don",,,,,,,,,,,,,,,
TRANSACTION,3320,010315189,30,41.0000,1230.00,"Credit for Limited Term Discount: Jesson, Don",,,,,,,,,,,,,,,
INVOICE,CM,,18910280,,11/01/2012,1555,"Invoice-Private",,11/01/2012,11/10/2012,,18915463MO,-3249.0000,,,,,,,,,,
TRANSACTION,3260,010315189,1,25,25,"Credit for Monthly Cable: Jesson, Don",,,,,,,,,,,,,,,
TRANSACTION,2094,010315189,30,10,300,"Credit for CC Meals: Jesson, Don",,,,,,,,,,,,,,,
TRANSACTION,3320,010315189,30,41,1230,"Limited Term Discount: Jesson, Don",,,,,,,,,,,,,,,
