BATCH,,201205,B,670.0000,
INVOICE,IN,,18910136,,05/01/2012,335.0000,"Invoice-Private",,05/01/2012,05/10/2012,,18915130MO,-5662.0000,,,,,,,,,,
TRANSACTION,3260,010315189,1,25.0000,25.00,"Monthly Cable: Jasper, Josephine",,,,,,,,,,,,,,,
TRANSACTION,2094,010315189,31,10.0000,310.00,"CC Meals: Jasper, Josephine",,,,,,,,,,,,,,,
INVOICE,CM,,18910136,,05/01/2012,335,"Invoice-Private",,05/01/2012,05/10/2012,,18915130MO,-5662.0000,,,,,,,,,,
TRANSACTION,3260,010315189,1,25,25,"Credit for Monthly Cable: Jasper, Josephine",,,,,,,,,,,,,,,
TRANSACTION,2094,010315189,31,10,310,"Credit for CC Meals: Jasper, Josephine",,,,,,,,,,,,,,,
