BATCH,,201211,B,2157.0000,
INVOICE,IN,,18410193,,11/30/2012,2157.0000,"MoveIn-Johnson. Irma (Lou)",,11/30/2012,11/30/2012,,18415428,6274.0000,,,,,,,,,,
TRANSACTION,3010,010313184,1,119.0000,119,"I.Johnson: Basic Service Fee - One Bedroom: Johnson. Irma (Lou)",,,,,,,,,,,,,,,
TRANSACTION,3017,010313184,1,13.0000,13,"I.Johnson: Resident Care - Level 1: Johnson. Irma (Lou)",,,,,,,,,,,,,,,
TRANSACTION,3260,010313184,1,25.0000,25,"Monthly Cable: Johnson. Irma (Lou)",,,,,,,,,,,,,,,
TRANSACTION,3216,010313184,1,2000.0000,2000,"New Resident Fee: Johnson. Irma (Lou)",,,,,,,,,,,,,,,
