BATCH,,201108,B,4654.0000,
INVOICE,IN,,15910210,,08/10/2011,4654.0000,"MoveIn-Sextro. Jeanette",,08/10/2011,08/10/2011,,15914356,4654.0000,,,,,,,,,,
TRANSACTION,3010,010212159,22,113.0000,2486,"J.Sextro: Basic Service Fee- One Bedroom Prem: Sextro. Jeanette",,,,,,,,,,,,,,,
TRANSACTION,3017,010212159,22,29.0000,638,"J.Sextro: Swan Personal Care - L2: Sextro. Jeanette",,,,,,,,,,,,,,,
TRANSACTION,3260,010212159,1,30.0000,30,"Monthly Cable: Sextro. Jeanette",,,,,,,,,,,,,,,
TRANSACTION,3216,010212159,1,1500.0000,1500,"New Resident Fee: Sextro. Jeanette",,,,,,,,,,,,,,,
