BATCH,,201210,B,1766.0000,
INVOICE,IN,,15910227,,10/30/2012,1766.0000,"MoveIn-McClellan. Yuriko",,10/30/2012,10/30/2012,,15914989,5336.0000,,,,,,,,,,
TRANSACTION,3010,010212159,2,102.0000,204,"Y.McClellan: Basic Service Fee- Studio Premium: McClellan. Yuriko",,,,,,,,,,,,,,,
TRANSACTION,3017,010212159,2,16.0000,32,"Y.McClellan: Swan Personal Care - L1: McClellan. Yuriko",,,,,,,,,,,,,,,
TRANSACTION,3260,010212159,1,30.0000,30,"Monthly Cable: McClellan. Yuriko",,,,,,,,,,,,,,,
TRANSACTION,3216,010212159,1,1500.0000,1500,"New Resident Fee: McClellan. Yuriko",,,,,,,,,,,,,,,
