BATCH,,201209,B,3365.0000,
INVOICE,IN,,17810353,,09/21/2012,3365.0000,"MoveIn-Shaver. Gertrude",,09/21/2012,09/21/2012,,17816213,8298.0000,,,,,,,,,,
TRANSACTION,3010,010212178,10,87.0000,870,"G.Shaver: Basic Service Fee - Studio: Shaver. Gertrude",,,,,,,,,,,,,,,
TRANSACTION,3017,010212178,10,71.0000,710,"G.Shaver: Swan Personal Care - L5: Shaver. Gertrude",,,,,,,,,,,,,,,
TRANSACTION,3260,010212178,1,35.0000,35,"Monthly Cable: Shaver. Gertrude",,,,,,,,,,,,,,,
TRANSACTION,3216,010212178,1,1750.0000,1750,"New Resident Fee: Shaver. Gertrude",,,,,,,,,,,,,,,
