BATCH,,201307,B,4965.0000,
INVOICE,IN,,17810385,,07/12/2013,4965.0000,"MoveIn-Powell. Kenneth",,07/12/2013,07/12/2013,,17816648,4965.0000,,,,,,,,,,
TRANSACTION,3010,010212178,20,89.0000,1780,"K.Powell: Basic Service Fee - Studio: Powell. Kenneth",,,,,,,,,,,,,,,
TRANSACTION,3017,010212178,20,44.0000,880,"K.Powell: Swan Personal Care - L3: Powell. Kenneth",,,,,,,,,,,,,,,
TRANSACTION,3260,010212178,1,35.0000,35,"Monthly Cable: Powell. Kenneth",,,,,,,,,,,,,,,
TRANSACTION,3216,010212178,1,2250.0000,2250,"New Resident Fee: Powell. Kenneth",,,,,,,,,,,,,,,
TRANSACTION,3228,010212178,1,20.0000,20,"Sharps Disposal - 4+ Per Day: Powell. Kenneth",,,,,,,,,,,,,,,
