BATCH,,201204,B,1250.0000,
INVOICE,IN,,04910083,,04/01/2012,625.0000,"Invoice-Private",,04/01/2012,04/10/2012,,04913339MO,-5823.7400,,,,,,,,,,
TRANSACTION,3260,010101049,1,25.0000,25.00,"Monthly Cable: Niemi, Elsie",,,,,,,,,,,,,,,
TRANSACTION,3320,010101049,30,20.0000,600.00,"Credit for Limited Term Discount: Niemi, Elsie",,,,,,,,,,,,,,,
INVOICE,CM,,04910083,,04/01/2012,625,"Invoice-Private",,04/01/2012,04/10/2012,,04913339MO,-5823.7400,,,,,,,,,,
TRANSACTION,3260,010101049,1,25,25,"Credit for Monthly Cable: Niemi, Elsie",,,,,,,,,,,,,,,
TRANSACTION,3320,010101049,30,20,600,"Limited Term Discount: Niemi, Elsie",,,,,,,,,,,,,,,
