BATCH,,201210,B,184.0000,
INVOICE,IN,,53510143,,10/01/2012,92.0000,"Invoice-Private",,10/01/2012,10/10/2012,,53514821MO,-5192.0000,,,,,,,,,,
TRANSACTION,3320,010319535,31,2.0000,62.00,"Credit for Limited Term Discount: Kastner, Robert",,,,,,,,,,,,,,,
TRANSACTION,3260,010319535,1,30.0000,30.00,"Monthly Cable: Kastner, Robert",,,,,,,,,,,,,,,
INVOICE,CM,,53510143,,10/01/2012,92,"Invoice-Private",,10/01/2012,10/10/2012,,53514821MO,-5192.0000,,,,,,,,,,
TRANSACTION,3320,010319535,31,2,62,"Limited Term Discount: Kastner, Robert",,,,,,,,,,,,,,,
TRANSACTION,3260,010319535,1,30,30,"Credit for Monthly Cable: Kastner, Robert",,,,,,,,,,,,,,,
