BATCH,,201212,B,130.0000,
INVOICE,IN,,53510215,,12/01/2012,65.0000,"Invoice-Private",,12/01/2012,12/10/2012,,53514954MO,-6365.0000,,,,,,,,,,
TRANSACTION,3260,010319535,1,30.0000,30.00,"Monthly Cable: Cornelius, Gertrude",,,,,,,,,,,,,,,
TRANSACTION,3130,010319535,1,35.0000,35.00,"Pendant Fee: Cornelius, Gertrude",,,,,,,,,,,,,,,
INVOICE,CM,,53510215,,12/01/2012,65,"Invoice-Private",,12/01/2012,12/10/2012,,53514954MO,-6365.0000,,,,,,,,,,
TRANSACTION,3260,010319535,1,30,30,"Credit for Monthly Cable: Cornelius, Gertrude",,,,,,,,,,,,,,,
TRANSACTION,3130,010319535,1,35,35,"Credit for Pendant Fee: Cornelius, Gertrude",,,,,,,,,,,,,,,
