BATCH,,201307,B,130.0000,
INVOICE,IN,,53510212,,07/01/2013,65.0000,"Invoice-Private",,07/01/2013,07/10/2013,,53515378MO,-4745.0000,,,,,,,,,,
TRANSACTION,3130,010319535,1,35.0000,35.00,"Pendant Fee: Rundle, Walter",,,,,,,,,,,,,,,
TRANSACTION,3260,010319535,1,30.0000,30.00,"Monthly Cable: Rundle, Walter",,,,,,,,,,,,,,,
INVOICE,CM,,53510212,,07/01/2013,65,"Invoice-Private",,07/01/2013,07/10/2013,,53515378MO,-4745.0000,,,,,,,,,,
TRANSACTION,3130,010319535,1,35,35,"Credit for Pendant Fee: Rundle, Walter",,,,,,,,,,,,,,,
TRANSACTION,3260,010319535,1,30,30,"Credit for Monthly Cable: Rundle, Walter",,,,,,,,,,,,,,,
