BATCH,,201301,B,3160.0000,
INVOICE,IN,,13510264,,01/01/2013,1580.0000,"Invoice-Private",,01/01/2013,01/10/2013,,13515495MO,-1250.0000,,,,,,,,,,
TRANSACTION,3260,010309135,1,30.0000,30.00,"Monthly Cable: Walker, James",,,,,,,,,,,,,,,
TRANSACTION,3320,010309135,31,50.0000,1550.00,"Credit for Limited Term Discount: Walker, James",,,,,,,,,,,,,,,
INVOICE,CM,,13510264,,01/01/2013,1580,"Invoice-Private",,01/01/2013,01/10/2013,,13515495MO,-1250.0000,,,,,,,,,,
TRANSACTION,3260,010309135,1,30,30,"Credit for Monthly Cable: Walker, James",,,,,,,,,,,,,,,
TRANSACTION,3320,010309135,31,50,1550,"Limited Term Discount: Walker, James",,,,,,,,,,,,,,,
