BATCH,,201110,B,2220.0000,
INVOICE,IN,,02910273,,10/01/2011,1110.0000,"Invoice-Private",,10/01/2011,10/10/2011,,02915335MO,-3205.0000,,,,,,,,,,
TRANSACTION,3260,010202029,1,25.0000,25.00,"Monthly Cable: Gonzales, Esquiel",,,,,,,,,,,,,,,
TRANSACTION,3320,010202029,31,35.0000,1085.00,"Credit for Limited Term Discount: Gonzales, Esquiel",,,,,,,,,,,,,,,
INVOICE,CM,,02910273,,10/01/2011,1110,"Invoice-Private",,10/01/2011,10/10/2011,,02915335MO,-3205.0000,,,,,,,,,,
TRANSACTION,3260,010202029,1,25,25,"Credit for Monthly Cable: Gonzales, Esquiel",,,,,,,,,,,,,,,
TRANSACTION,3320,010202029,31,35,1085,"Limited Term Discount: Gonzales, Esquiel",,,,,,,,,,,,,,,
