BATCH,,201204,B,2510.0000,
INVOICE,IN,,12810207,,04/01/2012,1255.0000,"Invoice-Private",,04/01/2012,04/10/2012,,12814740MO,-1236.0000,,,,,,,,,,
TRANSACTION,3260,010306128,1,25.0000,25.00,"Monthly Cable: Sanko, John",,,,,,,,,,,,,,,
TRANSACTION,3320,010306128,30,41.0000,1230.00,"Credit for Limited Term Discount: Sanko, John",,,,,,,,,,,,,,,
INVOICE,CM,,12810207,,04/01/2012,1255,"Invoice-Private",,04/01/2012,04/10/2012,,12814740MO,-1236.0000,,,,,,,,,,
TRANSACTION,3260,010306128,1,25,25,"Credit for Monthly Cable: Sanko, John",,,,,,,,,,,,,,,
TRANSACTION,3320,010306128,30,41,1230,"Limited Term Discount: Sanko, John",,,,,,,,,,,,,,,
