BATCH,,201302,B,182.0000,
INVOICE,IN,,15410231,,02/01/2013,91.0000,"Invoice-Private",,02/01/2013,02/10/2013,,15415221MO,-2703.0000,,,,,,,,,,
TRANSACTION,3260,010211154,1,35.0000,35.00,"Monthly Cable: Hicks, Marjorie",,,,,,,,,,,,,,,
TRANSACTION,3320,010211154,28,2.0000,56.00,"Credit for Limited Term Discount: Hicks, Marjorie",,,,,,,,,,,,,,,
INVOICE,CM,,15410231,,02/01/2013,91,"Invoice-Private",,02/01/2013,02/10/2013,,15415221MO,-2703.0000,,,,,,,,,,
TRANSACTION,3260,010211154,1,35,35,"Credit for Monthly Cable: Hicks, Marjorie",,,,,,,,,,,,,,,
TRANSACTION,3320,010211154,28,2,56,"Limited Term Discount: Hicks, Marjorie",,,,,,,,,,,,,,,
