BATCH,,201210,B,194.0000,
INVOICE,IN,,15410241,,10/01/2012,97.0000,"Invoice-Private",,10/01/2012,10/10/2012,,15415073MO,-3908.0000,,,,,,,,,,
TRANSACTION,3260,010211154,1,35.0000,35.00,"Monthly Cable: Stenger, Marjorie",,,,,,,,,,,,,,,
TRANSACTION,3320,010211154,31,2.0000,62.00,"Credit for Limited Term Discount: Stenger, Marjorie",,,,,,,,,,,,,,,
INVOICE,CM,,15410241,,10/01/2012,97,"Invoice-Private",,10/01/2012,10/10/2012,,15415073MO,-3908.0000,,,,,,,,,,
TRANSACTION,3260,010211154,1,35,35,"Credit for Monthly Cable: Stenger, Marjorie",,,,,,,,,,,,,,,
TRANSACTION,3320,010211154,31,2,62,"Limited Term Discount: Stenger, Marjorie",,,,,,,,,,,,,,,
