BATCH,,201109,B,410.0000,
INVOICE,IN,,05710285,,09/01/2011,205.0000,"Invoice-Private",,09/01/2011,09/10/2011,,05715183MO,-3484.0000,,,,,,,,,,
TRANSACTION,3260,010202057,1,25.0000,25.00,"Monthly Cable: Mackay, Gerald",,,,,,,,,,,,,,,
TRANSACTION,3320,010202057,30,6.0000,180.00,"Credit for Limited Term Discount: Mackay, Gerald",,,,,,,,,,,,,,,
INVOICE,CM,,05710285,,09/01/2011,205,"Invoice-Private",,09/01/2011,09/10/2011,,05715183MO,-3484.0000,,,,,,,,,,
TRANSACTION,3260,010202057,1,25,25,"Credit for Monthly Cable: Mackay, Gerald",,,,,,,,,,,,,,,
TRANSACTION,3320,010202057,30,6,180,"Limited Term Discount: Mackay, Gerald",,,,,,,,,,,,,,,
