BATCH,,201111,B,110.0000,
INVOICE,IN,,53210327,,11/01/2011,55.0000,"Invoice-Private",,11/01/2011,11/10/2011,,53215030MO,-4519.0000,,,,,,,,,,
TRANSACTION,3260,010319532,1,30.0000,30.00,"Monthly Cable: Miszczak, Daniel",,,,,,,,,,,,,,,
TRANSACTION,3130,010319532,1,25.0000,25.00,"Pendant Fee: Miszczak, Daniel",,,,,,,,,,,,,,,
INVOICE,CM,,53210327,,11/01/2011,55,"Invoice-Private",,11/01/2011,11/10/2011,,53215030MO,-4519.0000,,,,,,,,,,
TRANSACTION,3260,010319532,1,30,30,"Credit for Monthly Cable: Miszczak, Daniel",,,,,,,,,,,,,,,
TRANSACTION,3130,010319532,1,25,25,"Credit for Pendant Fee: Miszczak, Daniel",,,,,,,,,,,,,,,
