BATCH,,201205,B,2654.0000,
INVOICE,IN,,08110163,,05/01/2012,1327.0000,"Invoice-Private",,05/01/2012,05/10/2012,,08114381MO,-3559.3000,,,,,,,,,,
TRANSACTION,3260,010103081,1,25.0000,25.00,"Monthly Cable: Lockhart, Elizabeth",,,,,,,,,,,,,,,
TRANSACTION,3320,010103081,31,42.0000,1302.00,"Credit for Limited Term Discount: Lockhart, Elizabeth",,,,,,,,,,,,,,,
INVOICE,CM,,08110163,,05/01/2012,1327,"Invoice-Private",,05/01/2012,05/10/2012,,08114381MO,-3559.3000,,,,,,,,,,
TRANSACTION,3260,010103081,1,25,25,"Credit for Monthly Cable: Lockhart, Elizabeth",,,,,,,,,,,,,,,
TRANSACTION,3320,010103081,31,42,1302,"Limited Term Discount: Lockhart, Elizabeth",,,,,,,,,,,,,,,
