BATCH,,201210,B,2034.0000,
INVOICE,IN,,08110227,,10/01/2012,1017.0000,"Invoice-Private",,10/01/2012,10/10/2012,,08114486MO,-2532.3600,,,,,,,,,,
TRANSACTION,3260,010103081,1,25.0000,25.00,"Monthly Cable: Edwards, Theresa",,,,,,,,,,,,,,,
TRANSACTION,3320,010103081,31,32.0000,992.00,"Credit for Limited Term Discount: Edwards, Theresa",,,,,,,,,,,,,,,
INVOICE,CM,,08110227,,10/01/2012,1017,"Invoice-Private",,10/01/2012,10/10/2012,,08114486MO,-2532.3600,,,,,,,,,,
TRANSACTION,3260,010103081,1,25,25,"Credit for Monthly Cable: Edwards, Theresa",,,,,,,,,,,,,,,
TRANSACTION,3320,010103081,31,32,992,"Limited Term Discount: Edwards, Theresa",,,,,,,,,,,,,,,
