BATCH,,201111,B,3025.1800,
INVOICE,IN,,08110127,,11/01/2011,1512.5900,"Invoice-Medicaid",,11/01/2011,11/10/2011,,08114218MO,-2499.8900,,,,,,,,,,
TRANSACTION,3260,010103081,1,25.0000,25.00,"Monthly Cable: Vinzulis, Mary",,,,,,,,,,,,,,,
TRANSACTION,3012,010103081,1,1487.5900,1487.59,"State Medicaid: Vinzulis, Mary",,,,,,,,,,,,,,,
INVOICE,CM,,08110127,,11/01/2011,1512.59,"Invoice-Medicaid",,11/01/2011,11/10/2011,,08114218MO,-2499.8900,,,,,,,,,,
TRANSACTION,3260,010103081,1,25,25,"Credit for Monthly Cable: Vinzulis, Mary",,,,,,,,,,,,,,,
TRANSACTION,3012,010103081,1,1487.59,1487.59,"Credit for State Medicaid: Vinzulis, Mary",,,,,,,,,,,,,,,
