BATCH,,201108,B,178.0000,
INVOICE,IN,,19010191,,08/01/2011,89.0000,"Invoice-Private",,08/01/2011,08/10/2011,,19014183MO,-3718.0000,,,,,,,,,,
TRANSACTION,3260,010308190,1,27.0000,27.00,"Monthly Cable: Gray, Aldine",,,,,,,,,,,,,,,
TRANSACTION,3320,010308190,31,2.0000,62.00,"Credit for Limited Term Discount: Gray, Aldine",,,,,,,,,,,,,,,
INVOICE,CM,,19010191,,08/01/2011,89,"Invoice-Private",,08/01/2011,08/10/2011,,19014183MO,-3718.0000,,,,,,,,,,
TRANSACTION,3260,010308190,1,27,27,"Credit for Monthly Cable: Gray, Aldine",,,,,,,,,,,,,,,
TRANSACTION,3320,010308190,31,2,62,"Limited Term Discount: Gray, Aldine",,,,,,,,,,,,,,,
