BATCH,,201712,B,8616.4700,
INVOICE,IN,,14610412,,12/07/2017,8616.4700,"MoveIn-Drabek. Mary",,12/07/2017,12/07/2017,,14617383,8616.4700,,,,,,,,,,
TRANSACTION,3010,010009146,25,131.0000,3275,"Basic Service Fee - One Bedroom: Drabek. Mary",,,,,,,,,,,,,,,
TRANSACTION,3260,010009146,1,31.6000,31.6,"Monthly Cable: Drabek. Mary",,,,,,,,,,,,,,,
TRANSACTION,3216,010009146,1,3982.4000,3982.4,"Community Fee: Drabek. Mary",,,,,,,,,,,,,,,
TRANSACTION,3216,010009146,1,1327.4700,1327.47,"Monthly Deferral Charge: Drabek. Mary",,,,,,,,,,,,,,,
