BATCH,,201107,B,1228.0000,
INVOICE,IN,,03510133,,07/01/2011,614.0000,"Invoice-Private",,07/01/2011,07/10/2011,,03513171MO,-2629.0000,,,,,,,,,,
TRANSACTION,3260,010202035,1,25.0000,25.00,"Monthly Cable: Evans, Barbara",,,,,,,,,,,,,,,
TRANSACTION,3320,010202035,31,19.0000,589.00,"Credit for Limited Term Discount: Evans, Barbara",,,,,,,,,,,,,,,
INVOICE,CM,,03510133,,07/01/2011,614,"Invoice-Private",,07/01/2011,07/10/2011,,03513171MO,-2629.0000,,,,,,,,,,
TRANSACTION,3260,010202035,1,25,25,"Credit for Monthly Cable: Evans, Barbara",,,,,,,,,,,,,,,
TRANSACTION,3320,010202035,31,19,589,"Limited Term Discount: Evans, Barbara",,,,,,,,,,,,,,,
