BATCH,,201302,B,1846.0000,
INVOICE,IN,,02610276,,02/01/2013,923.0000,"Invoice-Private",,02/01/2013,02/10/2013,,02615070MO,-2225.0000,,,,,,,,,,
TRANSACTION,3260,010202026,1,27.0000,27.00,"Monthly Cable: Lewis, Virginia",,,,,,,,,,,,,,,
TRANSACTION,3320,010202026,28,32.0000,896.00,"Credit for Limited Term Discount: Lewis, Virginia",,,,,,,,,,,,,,,
INVOICE,CM,,02610276,,02/01/2013,923,"Invoice-Private",,02/01/2013,02/10/2013,,02615070MO,-2225.0000,,,,,,,,,,
TRANSACTION,3260,010202026,1,27,27,"Credit for Monthly Cable: Lewis, Virginia",,,,,,,,,,,,,,,
TRANSACTION,3320,010202026,28,32,896,"Limited Term Discount: Lewis, Virginia",,,,,,,,,,,,,,,
