BATCH,,201211,B,1919.0000,
INVOICE,IN,,02110214,,11/30/2012,1919.0000,"MoveIn-Evans. Margaret",,11/30/2012,11/30/2012,,02115107,5633.0000,,,,,,,,,,
TRANSACTION,3010,010202021,1,119.0000,119,"Basic Service Fee - One Bedroom: Evans. Margaret",,,,,,,,,,,,,,,
TRANSACTION,3260,010202021,1,25.0000,25,"Monthly Cable: Evans. Margaret",,,,,,,,,,,,,,,
TRANSACTION,3216,010202021,1,1750.0000,1750,"New Resident Fee: Evans. Margaret",,,,,,,,,,,,,,,
TRANSACTION,3260,010202021,1,25.0000,25,"Monthly Cable: Evans. Margaret",,,,,,,,,,,,,,,
