BATCH,,201107,B,26006.4000,
INVOICE,IN,,14010209,,07/08/2011,1603.2000,"Invoice-Respite",,07/08/2011,07/08/2011,,14013488MO,-22800.0000,,,,,,,,,,
TRANSACTION,3020,010309140,8,102.0000,816.00,"Basic Service Fee- Respite Studio for Jul: Zeedyk, Margaret",,,,,,,,,,,,,,,
TRANSACTION,3020,010309140,8,98.4000,787.20,"M.Zeedyk: Basic Service Fee- Respite Studio : Zeedyk, Margaret",,,,,,,,,,,,,,,
INVOICE,CM,,14010209,,07/08/2011,24403.2,"Invoice-Respite",,07/08/2011,07/08/2011,,14013488MO,-22800.0000,,,,,,,,,,
TRANSACTION,3020,010309140,8,3050.4,24403.2,"Basic Service Fee- Respite Studio for Jul: Zeedyk, Margaret",,,,,,,,,,,,,,,
