BATCH,,201302,B,1734.0000,
INVOICE,IN,,16510280,,02/01/2013,867.0000,"Invoice-Private",,02/01/2013,02/10/2013,,16514635MO,-2600.0000,,,,,,,,,,
TRANSACTION,3260,010308165,1,27.0000,27.00,"Monthly Cable: Gross, Frank",,,,,,,,,,,,,,,
TRANSACTION,3320,010308165,28,30.0000,840.00,"Credit for Limited Term Discount: Gross, Frank",,,,,,,,,,,,,,,
INVOICE,CM,,16510280,,02/01/2013,867,"Invoice-Private",,02/01/2013,02/10/2013,,16514635MO,-2600.0000,,,,,,,,,,
TRANSACTION,3260,010308165,1,27,27,"Credit for Monthly Cable: Gross, Frank",,,,,,,,,,,,,,,
TRANSACTION,3320,010308165,28,30,840,"Limited Term Discount: Gross, Frank",,,,,,,,,,,,,,,
