BATCH,,201301,B,5250.0000,
INVOICE,IN,,16510309,,01/01/2013,2625.0000,"Invoice-Private",,01/01/2013,01/10/2013,,16514594MO,-1725.0000,,,,,,,,,,
TRANSACTION,3260,010308165,1,27.0000,27.00,"Monthly Cable: McCormick, Helen",,,,,,,,,,,,,,,
TRANSACTION,3320,010308165,31,42.0000,1302.00,"Credit for Limited Term Discount: McCormick, Helen",,,,,,,,,,,,,,,
TRANSACTION,3210,010308165,108,12.0000,1296.00,"Personal Services: McCormick, Helen",,,,,,,,,,,,,,,
INVOICE,CM,,16510309,,01/01/2013,2625,"Invoice-Private",,01/01/2013,01/10/2013,,16514594MO,-1725.0000,,,,,,,,,,
TRANSACTION,3260,010308165,1,27,27,"Credit for Monthly Cable: McCormick, Helen",,,,,,,,,,,,,,,
TRANSACTION,3320,010308165,31,42,1302,"Limited Term Discount: McCormick, Helen",,,,,,,,,,,,,,,
TRANSACTION,3210,010308165,108,12,1296,"Credit for Personal Services: McCormick, Helen",,,,,,,,,,,,,,,
