BATCH,,201203,B,2348.0000,
INVOICE,IN,,16510289,,03/01/2012,1174.0000,"Invoice-Private",,03/01/2012,03/10/2012,,16514101MO,-2796.0000,,,,,,,,,,
TRANSACTION,3260,010308165,1,27.0000,27.00,"Monthly Cable: Platt, Howard",,,,,,,,,,,,,,,
TRANSACTION,3320,010308165,31,37.0000,1147.00,"Credit for Limited Term Discount: Platt, Howard",,,,,,,,,,,,,,,
INVOICE,CM,,16510289,,03/01/2012,1174,"Invoice-Private",,03/01/2012,03/10/2012,,16514101MO,-2796.0000,,,,,,,,,,
TRANSACTION,3260,010308165,1,27,27,"Credit for Monthly Cable: Platt, Howard",,,,,,,,,,,,,,,
TRANSACTION,3320,010308165,31,37,1147,"Limited Term Discount: Platt, Howard",,,,,,,,,,,,,,,
