BATCH,,201111,B,1374.0000,
INVOICE,IN,,16510250,,11/01/2011,687.0000,"Invoice-Private",,11/01/2011,11/10/2011,,16513916MO,-3220.0000,,,,,,,,,,
TRANSACTION,3260,010308165,1,27.0000,27.00,"Monthly Cable: Lewis, Ronald",,,,,,,,,,,,,,,
TRANSACTION,3320,010308165,30,22.0000,660.00,"Credit for Limited Term Discount: Lewis, Ronald",,,,,,,,,,,,,,,
INVOICE,CM,,16510250,,11/01/2011,687,"Invoice-Private",,11/01/2011,11/10/2011,,16513916MO,-3220.0000,,,,,,,,,,
TRANSACTION,3260,010308165,1,27,27,"Credit for Monthly Cable: Lewis, Ronald",,,,,,,,,,,,,,,
TRANSACTION,3320,010308165,30,22,660,"Limited Term Discount: Lewis, Ronald",,,,,,,,,,,,,,,
