BATCH,,201209,B,174.0000,
INVOICE,IN,,16510248,,09/01/2012,87.0000,"Invoice-Private",,09/01/2012,09/10/2012,,16514392MO,-2863.0000,,,,,,,,,,
TRANSACTION,3260,010308165,1,27.0000,27.00,"Monthly Cable: Johnson, Christine",,,,,,,,,,,,,,,
TRANSACTION,3320,010308165,30,2.0000,60.00,"Credit for Limited Term Discount: Johnson, Christine",,,,,,,,,,,,,,,
INVOICE,CM,,16510248,,09/01/2012,87,"Invoice-Private",,09/01/2012,09/10/2012,,16514392MO,-2863.0000,,,,,,,,,,
TRANSACTION,3260,010308165,1,27,27,"Credit for Monthly Cable: Johnson, Christine",,,,,,,,,,,,,,,
TRANSACTION,3320,010308165,30,2,60,"Limited Term Discount: Johnson, Christine",,,,,,,,,,,,,,,
