BATCH,,201302,B,2122.0000,
INVOICE,IN,,16910246,,02/01/2013,1061.0000,"Invoice-Private",,02/01/2013,02/10/2013,,16915324MO,-3739.1100,,,,,,,,,,
TRANSACTION,3260,010103169,1,25.0000,25.00,"Monthly Cable: Graves, Anne",,,,,,,,,,,,,,,
TRANSACTION,3320,010103169,28,37.0000,1036.00,"Credit for Limited Term Discount: Graves, Anne",,,,,,,,,,,,,,,
INVOICE,CM,,16910246,,02/01/2013,1061,"Invoice-Private",,02/01/2013,02/10/2013,,16915324MO,-3739.1100,,,,,,,,,,
TRANSACTION,3260,010103169,1,25,25,"Credit for Monthly Cable: Graves, Anne",,,,,,,,,,,,,,,
TRANSACTION,3320,010103169,28,37,1036,"Limited Term Discount: Graves, Anne",,,,,,,,,,,,,,,
