BATCH,,201207,B,224.0000,
INVOICE,IN,,52910155,,07/01/2012,112.0000,"Invoice-Private",,07/01/2012,07/10/2012,,52913123MO,-5477.0000,,,,,,,,,,
TRANSACTION,3130,010319529,1,25.0000,25.00,"Pendant Fee: Bonde, Roman",,,,,,,,,,,,,,,
TRANSACTION,3320,010319529,31,2.0000,62.00,"Credit for Limited Term Discount: Bonde, Roman",,,,,,,,,,,,,,,
TRANSACTION,3260,010319529,1,25.0000,25.00,"Monthly Cable: Bonde, Roman",,,,,,,,,,,,,,,
INVOICE,CM,,52910155,,07/01/2012,112,"Invoice-Private",,07/01/2012,07/10/2012,,52913123MO,-5477.0000,,,,,,,,,,
TRANSACTION,3130,010319529,1,25,25,"Credit for Pendant Fee: Bonde, Roman",,,,,,,,,,,,,,,
TRANSACTION,3320,010319529,31,2,62,"Limited Term Discount: Bonde, Roman",,,,,,,,,,,,,,,
TRANSACTION,3260,010319529,1,25,25,"Credit for Monthly Cable: Bonde, Roman",,,,,,,,,,,,,,,
