BATCH,,201302,B,152.0000,
INVOICE,IN,,52910114,,02/01/2013,76.0000,"Invoice-Private",,02/01/2013,02/10/2013,,52913436MO,-6297.0000,,,,,,,,,,
TRANSACTION,3320,010319529,28,2.0000,56.00,"Credit for Limited Term Discount: Wilkens, Elaine",,,,,,,,,,,,,,,
TRANSACTION,3130,010319529,1,20.0000,20.00,"Pendant Fee: Wilkens, Elaine",,,,,,,,,,,,,,,
INVOICE,CM,,52910114,,02/01/2013,76,"Invoice-Private",,02/01/2013,02/10/2013,,52913436MO,-6297.0000,,,,,,,,,,
TRANSACTION,3320,010319529,28,2,56,"Limited Term Discount: Wilkens, Elaine",,,,,,,,,,,,,,,
TRANSACTION,3130,010319529,1,20,20,"Credit for Pendant Fee: Wilkens, Elaine",,,,,,,,,,,,,,,
