BATCH,,201301,B,1424.0000,
INVOICE,IN,,13910191,,01/01/2013,712.0000,"Invoice-Private",,01/01/2013,01/10/2013,,13916476MO,-4308.6400,,,,,,,,,,
TRANSACTION,3260,010103139,1,30.0000,30.00,"Monthly Cable: McCurdy, Floyd",,,,,,,,,,,,,,,
TRANSACTION,3320,010103139,31,22.0000,682.00,"Credit for Limited Term Discount: McCurdy, Floyd",,,,,,,,,,,,,,,
INVOICE,CM,,13910191,,01/01/2013,712,"Invoice-Private",,01/01/2013,01/10/2013,,13916476MO,-4308.6400,,,,,,,,,,
TRANSACTION,3260,010103139,1,30,30,"Credit for Monthly Cable: McCurdy, Floyd",,,,,,,,,,,,,,,
TRANSACTION,3320,010103139,31,22,682,"Limited Term Discount: McCurdy, Floyd",,,,,,,,,,,,,,,
