BATCH,,201301,B,184.0000,
INVOICE,IN,,13910255,,01/01/2013,92.0000,"Invoice-Private",,01/01/2013,01/10/2013,,13916475MO,-6643.4000,,,,,,,,,,
TRANSACTION,3260,010103139,1,30.0000,30.00,"Monthly Cable: Weeth, Pete",,,,,,,,,,,,,,,
TRANSACTION,3320,010103139,31,2.0000,62.00,"Credit for Limited Term Discount: Weeth, Pete",,,,,,,,,,,,,,,
INVOICE,CM,,13910255,,01/01/2013,92,"Invoice-Private",,01/01/2013,01/10/2013,,13916475MO,-6643.4000,,,,,,,,,,
TRANSACTION,3260,010103139,1,30,30,"Credit for Monthly Cable: Weeth, Pete",,,,,,,,,,,,,,,
TRANSACTION,3320,010103139,31,2,62,"Limited Term Discount: Weeth, Pete",,,,,,,,,,,,,,,
