BATCH,,201302,B,172.0000,
INVOICE,IN,,13910193,,02/01/2013,86.0000,"Invoice-Private",,02/01/2013,02/10/2013,,13916520MO,-6348.4200,,,,,,,,,,
TRANSACTION,3260,010103139,1,30.0000,30.00,"Monthly Cable: Shimojima, Rosie",,,,,,,,,,,,,,,
TRANSACTION,3320,010103139,28,2.0000,56.00,"Credit for Limited Term Discount: Shimojima, Rosie",,,,,,,,,,,,,,,
INVOICE,CM,,13910193,,02/01/2013,86,"Invoice-Private",,02/01/2013,02/10/2013,,13916520MO,-6348.4200,,,,,,,,,,
TRANSACTION,3260,010103139,1,30,30,"Credit for Monthly Cable: Shimojima, Rosie",,,,,,,,,,,,,,,
TRANSACTION,3320,010103139,28,2,56,"Limited Term Discount: Shimojima, Rosie",,,,,,,,,,,,,,,
