BATCH,,201302,B,1977.0000,
INVOICE,IN,,03110361,,02/21/2013,1977.0000,"MoveIn-Smith. Gay Nell",,02/21/2013,02/21/2013,,03117339,5599.0000,,,,,,,,,,
TRANSACTION,3010,010202031,8,99.0000,792,"G.Smith: Basic Service Fee - Studio: Smith. Gay Nell",,,,,,,,,,,,,,,
TRANSACTION,3017,010202031,8,16.0000,128,"G.Smith: Resident Care - Level 1: Smith. Gay Nell",,,,,,,,,,,,,,,
TRANSACTION,3260,010202031,1,27.0000,27,"Monthly Cable: Smith. Gay Nell",,,,,,,,,,,,,,,
TRANSACTION,3216,010202031,1,1000.0000,1000,"New Resident Fee: Smith. Gay Nell",,,,,,,,,,,,,,,
TRANSACTION,3130,010202031,1,30.0000,30,"Pendant Fee: Smith. Gay Nell",,,,,,,,,,,,,,,
