BATCH,,201112,B,2390.8500,
INVOICE,IN,,51710194,,12/29/2011,2390.8500,"MoveIn-Crain. Audrey",,12/29/2011,12/29/2011,,51712809,6196.3000,,,,,,,,,,
TRANSACTION,3010,010103517,3,113.0000,339,"A.Crain: Basic Service Fee - One Bedroom: Crain. Audrey",,,,,,,,,,,,,,,
TRANSACTION,3017,010103517,3,8.9500,26.85,"A.Crain: Resident Care - Level 5: Crain. Audrey",,,,,,,,,,,,,,,
TRANSACTION,3260,010103517,1,25.0000,25,"Monthly Cable: Crain. Audrey",,,,,,,,,,,,,,,
TRANSACTION,3216,010103517,1,2000.0000,2000,"New Resident Fee: Crain. Audrey",,,,,,,,,,,,,,,
