BATCH,,201301,B,2766.0000,
INVOICE,IN,,51710227,,01/22/2013,2766.0000,"MoveIn-Gwynn. Alfred",,01/22/2013,01/22/2013,,51713239,6265.8000,,,,,,,,,,
TRANSACTION,3010,010103517,10,113.0000,1130,"A.Gwynn: Basic Service Fee - One Bedroom: Gwynn. Alfred",,,,,,,,,,,,,,,
TRANSACTION,3017,010103517,10,11.1000,111,"A.Gwynn: Resident Care - Level 6: Gwynn. Alfred",,,,,,,,,,,,,,,
TRANSACTION,3260,010103517,1,25.0000,25,"Monthly Cable: Gwynn. Alfred",,,,,,,,,,,,,,,
TRANSACTION,3216,010103517,1,1500.0000,1500,"New Resident Fee: Gwynn. Alfred",,,,,,,,,,,,,,,
