BATCH,,201209,B,2772.0000,
INVOICE,IN,,07810244,,09/10/2012,2772.0000,"MoveIn-Rodrick. Tillie",,09/10/2012,09/10/2012,,07814510,2772.0000,,,,,,,,,,
TRANSACTION,3010,010104078,21,92.0000,1932,"T.Rodrick: Basic Service Fee - One Bedroom: Rodrick. Tillie",,,,,,,,,,,,,,,
TRANSACTION,3017,010104078,21,15.0000,315,"T.Rodrick: Resident Care - Level 1: Rodrick. Tillie",,,,,,,,,,,,,,,
TRANSACTION,3260,010104078,1,25.0000,25,"Monthly Cable: Rodrick. Tillie",,,,,,,,,,,,,,,
TRANSACTION,3216,010104078,1,500.0000,500,"New Resident Fee: Rodrick. Tillie",,,,,,,,,,,,,,,
