BATCH,,201309,B,120.0000,
INVOICE,IN,,53010088,,09/01/2013,60.0000,"Invoice-Private",,09/01/2013,09/10/2013,,53017004MO,-6672.0000,,,,,,,,,,
TRANSACTION,3260,010319530,1,40.0000,40.00,"Monthly Cable: Hermann, Shirley",,,,,,,,,,,,,,,
TRANSACTION,3130,010319530,1,20.0000,20.00,"Pendant Fee: Hermann, Shirley",,,,,,,,,,,,,,,
INVOICE,CM,,53010088,,09/01/2013,60,"Invoice-Private",,09/01/2013,09/10/2013,,53017004MO,-6672.0000,,,,,,,,,,
TRANSACTION,3260,010319530,1,40,40,"Credit for Monthly Cable: Hermann, Shirley",,,,,,,,,,,,,,,
TRANSACTION,3130,010319530,1,20,20,"Credit for Pendant Fee: Hermann, Shirley",,,,,,,,,,,,,,,
