BATCH,,201110,B,120.0000,
INVOICE,IN,,53010225,,10/01/2011,60.0000,"Invoice-Private",,10/01/2011,10/10/2011,,53015375MO,-7264.0000,,,,,,,,,,
TRANSACTION,3260,010319530,1,40.0000,40.00,"Monthly Cable: Ortlieb, Myrtle",,,,,,,,,,,,,,,
TRANSACTION,3130,010319530,1,20.0000,20.00,"Pendant Fee: Ortlieb, Myrtle",,,,,,,,,,,,,,,
INVOICE,CM,,53010225,,10/01/2011,60,"Invoice-Private",,10/01/2011,10/10/2011,,53015375MO,-7264.0000,,,,,,,,,,
TRANSACTION,3260,010319530,1,40,40,"Credit for Monthly Cable: Ortlieb, Myrtle",,,,,,,,,,,,,,,
TRANSACTION,3130,010319530,1,20,20,"Credit for Pendant Fee: Ortlieb, Myrtle",,,,,,,,,,,,,,,
