BATCH,,201303,B,120.0000,
INVOICE,IN,,53010202,,03/01/2013,60.0000,"Invoice-Private",,03/01/2013,03/10/2013,,53016679MO,-5268.0000,,,,,,,,,,
TRANSACTION,3260,010319530,1,40.0000,40.00,"Monthly Cable: Hildebrandt, Beverly",,,,,,,,,,,,,,,
TRANSACTION,3130,010319530,1,20.0000,20.00,"Pendant Fee: Hildebrandt, Beverly",,,,,,,,,,,,,,,
INVOICE,CM,,53010202,,03/01/2013,60,"Invoice-Private",,03/01/2013,03/10/2013,,53016679MO,-5268.0000,,,,,,,,,,
TRANSACTION,3260,010319530,1,40,40,"Credit for Monthly Cable: Hildebrandt, Beverly",,,,,,,,,,,,,,,
TRANSACTION,3130,010319530,1,20,20,"Credit for Pendant Fee: Hildebrandt, Beverly",,,,,,,,,,,,,,,
