BATCH,,201309,B,140.0000,
INVOICE,IN,,53010230,,09/01/2013,70.0000,"Invoice-Private",,09/01/2013,09/10/2013,,53017007MO,-4942.0000,,,,,,,,,,
TRANSACTION,3260,010319530,1,40.0000,40.00,"Monthly Cable: Stone, Elmer",,,,,,,,,,,,,,,
TRANSACTION,3130,010319530,1,20.0000,20.00,"Pendant Fee: Stone, Elmer",,,,,,,,,,,,,,,
TRANSACTION,3228,010319530,1,10.0000,10.00,"Sharps Disposal - 2 Per Day: Stone, Elmer",,,,,,,,,,,,,,,
INVOICE,CM,,53010230,,09/01/2013,70,"Invoice-Private",,09/01/2013,09/10/2013,,53017007MO,-4942.0000,,,,,,,,,,
TRANSACTION,3260,010319530,1,40,40,"Credit for Monthly Cable: Stone, Elmer",,,,,,,,,,,,,,,
TRANSACTION,3130,010319530,1,20,20,"Credit for Pendant Fee: Stone, Elmer",,,,,,,,,,,,,,,
TRANSACTION,3228,010319530,1,10,10,"Credit for Sharps Disposal - 2 Per Day: Stone, Elmer",,,,,,,,,,,,,,,
