BATCH,,201208,B,204.0000,
INVOICE,IN,,53010043,,08/01/2012,102.0000,"Invoice-Private",,08/01/2012,08/10/2012,,53016226MO,-3543.0000,,,,,,,,,,
TRANSACTION,3260,010319530,1,40.0000,40.00,"Monthly Cable: Schulze, Harold",,,,,,,,,,,,,,,
TRANSACTION,3320,010319530,31,2.0000,62.00,"Credit for Limited Term Discount: Schulze, Harold",,,,,,,,,,,,,,,
INVOICE,CM,,53010043,,08/01/2012,102,"Invoice-Private",,08/01/2012,08/10/2012,,53016226MO,-3543.0000,,,,,,,,,,
TRANSACTION,3260,010319530,1,40,40,"Credit for Monthly Cable: Schulze, Harold",,,,,,,,,,,,,,,
TRANSACTION,3320,010319530,31,2,62,"Limited Term Discount: Schulze, Harold",,,,,,,,,,,,,,,
