BATCH,,201202,B,286.0000,
INVOICE,IN,,53010197,,02/01/2012,143.0000,"Invoice-Private",,02/01/2012,02/10/2012,,53015737MO,-6028.0000,,,,,,,,,,
TRANSACTION,3260,010319530,1,40.0000,40.00,"Monthly Cable: Oneil, Fred ",,,,,,,,,,,,,,,
TRANSACTION,3214,010319530,1,45.0000,45.00,"Garage Rental: Oneil, Fred ",,,,,,,,,,,,,,,
TRANSACTION,3320,010319530,29,2.0000,58.00,"Credit for Limited Term Discount: Oneil, Fred ",,,,,,,,,,,,,,,
INVOICE,CM,,53010197,,02/01/2012,143,"Invoice-Private",,02/01/2012,02/10/2012,,53015737MO,-6028.0000,,,,,,,,,,
TRANSACTION,3260,010319530,1,40,40,"Credit for Monthly Cable: Oneil, Fred ",,,,,,,,,,,,,,,
TRANSACTION,3214,010319530,1,45,45,"Credit for Garage Rental: Oneil, Fred ",,,,,,,,,,,,,,,
TRANSACTION,3320,010319530,29,2,58,"Limited Term Discount: Oneil, Fred ",,,,,,,,,,,,,,,
