BATCH,,201108,B,1228.0000,
INVOICE,IN,,07810220,,08/01/2011,614.0000,"Invoice-Private",,08/01/2011,08/10/2011,,07814280MO,-5123.0000,,,,,,,,,,
TRANSACTION,3260,010104078,1,25.0000,25.00,"Monthly Cable: Stearns, Mildred",,,,,,,,,,,,,,,
TRANSACTION,3320,010104078,31,19.0000,589.00,"Credit for Limited Term Discount: Stearns, Mildred",,,,,,,,,,,,,,,
INVOICE,CM,,07810220,,08/01/2011,614,"Invoice-Private",,08/01/2011,08/10/2011,,07814280MO,-5123.0000,,,,,,,,,,
TRANSACTION,3260,010104078,1,25,25,"Credit for Monthly Cable: Stearns, Mildred",,,,,,,,,,,,,,,
TRANSACTION,3320,010104078,31,19,589,"Limited Term Discount: Stearns, Mildred",,,,,,,,,,,,,,,
