BATCH,,201112,B,2468.0000,
INVOICE,IN,,07810219,,12/01/2011,1234.0000,"Invoice-Private",,12/01/2011,12/10/2011,,07814387MO,-1623.0000,,,,,,,,,,
TRANSACTION,3260,010104078,1,25.0000,25.00,"Monthly Cable: Baum, Esther",,,,,,,,,,,,,,,
TRANSACTION,3320,010104078,31,39.0000,1209.00,"Credit for Limited Term Discount: Baum, Esther",,,,,,,,,,,,,,,
INVOICE,CM,,07810219,,12/01/2011,1234,"Invoice-Private",,12/01/2011,12/10/2011,,07814387MO,-1623.0000,,,,,,,,,,
TRANSACTION,3260,010104078,1,25,25,"Credit for Monthly Cable: Baum, Esther",,,,,,,,,,,,,,,
TRANSACTION,3320,010104078,31,39,1209,"Limited Term Discount: Baum, Esther",,,,,,,,,,,,,,,
