BATCH,,201111,B,160.0000,
INVOICE,IN,,53110093,,11/01/2011,80.0000,"Invoice-Private",,11/01/2011,11/10/2011,,53113833MO,-3771.0000,,,,,,,,,,
TRANSACTION,3130,010319531,1,20.0000,20.00,"Pendant Fee: Bozic, Antonija",,,,,,,,,,,,,,,
TRANSACTION,3320,010319531,30,2.0000,60.00,"Credit for Limited Term Discount: Bozic, Antonija",,,,,,,,,,,,,,,
INVOICE,CM,,53110093,,11/01/2011,80,"Invoice-Private",,11/01/2011,11/10/2011,,53113833MO,-3771.0000,,,,,,,,,,
TRANSACTION,3130,010319531,1,20,20,"Credit for Pendant Fee: Bozic, Antonija",,,,,,,,,,,,,,,
TRANSACTION,3320,010319531,30,2,60,"Limited Term Discount: Bozic, Antonija",,,,,,,,,,,,,,,
