BATCH,,201112,B,100.0000,
INVOICE,IN,,53310197,,12/01/2011,50.0000,"Invoice-Private",,12/01/2011,12/10/2011,,53314124MO,-1971.0000,,,,,,,,,,
TRANSACTION,3260,010319533,1,25.0000,25.00,"Monthly Cable: Post, Grayce",,,,,,,,,,,,,,,
TRANSACTION,3130,010319533,1,25.0000,25.00,"Pendant Fee: Post, Grayce",,,,,,,,,,,,,,,
INVOICE,CM,,53310197,,12/01/2011,50,"Invoice-Private",,12/01/2011,12/10/2011,,53314124MO,-1971.0000,,,,,,,,,,
TRANSACTION,3260,010319533,1,25,25,"Credit for Monthly Cable: Post, Grayce",,,,,,,,,,,,,,,
TRANSACTION,3130,010319533,1,25,25,"Credit for Pendant Fee: Post, Grayce",,,,,,,,,,,,,,,
