BATCH,,201106,B,100.0000,
INVOICE,IN,,53310129,,06/01/2011,50.0000,"Invoice-Private",,06/01/2011,06/10/2011,,53313657MO,-3316.0000,,,,,,,,,,
TRANSACTION,3260,010319533,1,25.0000,25.00,"Monthly Cable: Smith, June",,,,,,,,,,,,,,,
TRANSACTION,3130,010319533,1,25.0000,25.00,"Pendant Fee: Smith, June",,,,,,,,,,,,,,,
INVOICE,CM,,53310129,,06/01/2011,50,"Invoice-Private",,06/01/2011,06/10/2011,,53313657MO,-3316.0000,,,,,,,,,,
TRANSACTION,3260,010319533,1,25,25,"Credit for Monthly Cable: Smith, June",,,,,,,,,,,,,,,
TRANSACTION,3130,010319533,1,25,25,"Credit for Pendant Fee: Smith, June",,,,,,,,,,,,,,,
