BATCH,,201303,B,100.0000,
INVOICE,IN,,53310195,,03/01/2013,50.0000,"Invoice-Private",,03/01/2013,03/10/2013,,53315206MO,-4212.0000,,,,,,,,,,
TRANSACTION,3130,010319533,1,25.0000,25.00,"Pendant Fee: Rivard, Bernadette",,,,,,,,,,,,,,,
TRANSACTION,3260,010319533,1,25.0000,25.00,"Monthly Cable: Rivard, Bernadette",,,,,,,,,,,,,,,
INVOICE,CM,,53310195,,03/01/2013,50,"Invoice-Private",,03/01/2013,03/10/2013,,53315206MO,-4212.0000,,,,,,,,,,
TRANSACTION,3130,010319533,1,25,25,"Credit for Pendant Fee: Rivard, Bernadette",,,,,,,,,,,,,,,
TRANSACTION,3260,010319533,1,25,25,"Credit for Monthly Cable: Rivard, Bernadette",,,,,,,,,,,,,,,
