BATCH,,201305,B,4320.0000,
INVOICE,IN,,53610227,,05/09/2013,4320.0000,"MoveIn-Tandberg. Jeanette",,05/09/2013,05/09/2013,,53613991,4320.0000,,,,,,,,,,
TRANSACTION,3010,010319536,23,91.0000,2093,"J.Tandberg: Basic Service Fee - Studio Deluxe: Tandberg. Jeanette",,,,,,,,,,,,,,,
TRANSACTION,3017,010319536,23,29.0000,667,"J.Tandberg: Resident Care - Level 2: Tandberg. Jeanette",,,,,,,,,,,,,,,
TRANSACTION,3260,010319536,1,35.0000,35,"Monthly Cable: Tandberg. Jeanette",,,,,,,,,,,,,,,
TRANSACTION,3216,010319536,1,1500.0000,1500,"New Resident Fee: Tandberg. Jeanette",,,,,,,,,,,,,,,
TRANSACTION,3130,010319536,1,25.0000,25,"Pendant Fee: Tandberg. Jeanette",,,,,,,,,,,,,,,
