BATCH,,201304,B,3840.0000,
INVOICE,IN,,53610221,,04/12/2013,3840.0000,"MoveIn-Gilbertson. Roger",,04/12/2013,04/12/2013,,53613942,3840.0000,,,,,,,,,,
TRANSACTION,3010,010319536,19,91.0000,1729,"R.Gilbertson: Basic Service Fee - Studio Deluxe: Gilbertson. Roger",,,,,,,,,,,,,,,
TRANSACTION,3017,010319536,19,29.0000,551,"R.Gilbertson: Resident Care - Level 2: Gilbertson. Roger",,,,,,,,,,,,,,,
TRANSACTION,3260,010319536,1,35.0000,35,"Monthly Cable: Gilbertson. Roger",,,,,,,,,,,,,,,
TRANSACTION,3216,010319536,1,1500.0000,1500,"New Resident Fee: Gilbertson. Roger",,,,,,,,,,,,,,,
TRANSACTION,3130,010319536,1,25.0000,25,"Pendant Fee: Gilbertson. Roger",,,,,,,,,,,,,,,
