BATCH,,201107,B,180.0000,
INVOICE,IN,,14410179,,07/01/2011,90.0000,"Invoice-Private",,07/01/2011,07/10/2011,,14414666MO,-3829.0000,,,,,,,,,,
TRANSACTION,3260,010308144,1,28.0000,28.00,"Monthly Cable: Pettigrew, Inez",,,,,,,,,,,,,,,
TRANSACTION,3320,010308144,31,2.0000,62.00,"Credit for Limited Term Discount: Pettigrew, Inez",,,,,,,,,,,,,,,
INVOICE,CM,,14410179,,07/01/2011,90,"Invoice-Private",,07/01/2011,07/10/2011,,14414666MO,-3829.0000,,,,,,,,,,
TRANSACTION,3260,010308144,1,28,28,"Credit for Monthly Cable: Pettigrew, Inez",,,,,,,,,,,,,,,
TRANSACTION,3320,010308144,31,2,62,"Limited Term Discount: Pettigrew, Inez",,,,,,,,,,,,,,,
