BATCH,,201208,B,106.0000,
INVOICE,IN,,14410210,,08/01/2012,53.0000,"Invoice-Private",,08/01/2012,08/10/2012,,14415210MO,-4428.0000,,,,,,,,,,
TRANSACTION,3130,010308144,1,25.0000,25.00,"Pendant Fee: Heape, Branford",,,,,,,,,,,,,,,
TRANSACTION,3260,010308144,1,28.0000,28.00,"Monthly Cable: Heape, Branford",,,,,,,,,,,,,,,
INVOICE,CM,,14410210,,08/01/2012,53,"Invoice-Private",,08/01/2012,08/10/2012,,14415210MO,-4428.0000,,,,,,,,,,
TRANSACTION,3130,010308144,1,25,25,"Credit for Pendant Fee: Heape, Branford",,,,,,,,,,,,,,,
TRANSACTION,3260,010308144,1,28,28,"Credit for Monthly Cable: Heape, Branford",,,,,,,,,,,,,,,
