BATCH,,201110,B,194.0000,
INVOICE,IN,,50310224,,10/01/2011,97.0000,"Invoice-Private",,10/01/2011,10/10/2011,,50313712MO,-1437.0000,,,,,,,,,,
TRANSACTION,3260,010220503,1,35.0000,35.00,"Monthly Cable: Walters, Beatrice",,,,,,,,,,,,,,,
TRANSACTION,3320,010220503,31,2.0000,62.00,"Credit for Limited Term Discount: Walters, Beatrice",,,,,,,,,,,,,,,
INVOICE,CM,,50310224,,10/01/2011,97,"Invoice-Private",,10/01/2011,10/10/2011,,50313712MO,-1437.0000,,,,,,,,,,
TRANSACTION,3260,010220503,1,35,35,"Credit for Monthly Cable: Walters, Beatrice",,,,,,,,,,,,,,,
TRANSACTION,3320,010220503,31,2,62,"Limited Term Discount: Walters, Beatrice",,,,,,,,,,,,,,,
