BATCH,,201203,B,1352.0000,
INVOICE,IN,,50210177,,03/01/2012,676.0000,"Invoice-Private",,03/01/2012,03/10/2012,,50213294MO,-1873.0000,,,,,,,,,,
TRANSACTION,3260,010209502,1,25.0000,25.00,"Monthly Cable: Byrer, Myrtle",,,,,,,,,,,,,,,
TRANSACTION,3320,010209502,31,21.0000,651.00,"Credit for Limited Term Discount: Byrer, Myrtle",,,,,,,,,,,,,,,
INVOICE,CM,,50210177,,03/01/2012,676,"Invoice-Private",,03/01/2012,03/10/2012,,50213294MO,-1873.0000,,,,,,,,,,
TRANSACTION,3260,010209502,1,25,25,"Credit for Monthly Cable: Byrer, Myrtle",,,,,,,,,,,,,,,
TRANSACTION,3320,010209502,31,21,651,"Limited Term Discount: Byrer, Myrtle",,,,,,,,,,,,,,,
