BATCH,,201109,B,370.0000,
INVOICE,IN,,50110014,,09/01/2011,185.0000,"Invoice-Private",,09/01/2011,09/10/2011,,50113606MO,-5860.0000,,,,,,,,,,
TRANSACTION,3260,010209501,1,30.0000,30.00,"Monthly Cable: Erickson, Dorothy",,,,,,,,,,,,,,,
TRANSACTION,3320,010209501,30,4.0000,120.00,"Credit for Limited Term Discount: Erickson, Dorothy",,,,,,,,,,,,,,,
TRANSACTION,3130,010209501,1,35.0000,35.00,"Pendant Fee: Erickson, Dorothy",,,,,,,,,,,,,,,
INVOICE,CM,,50110014,,09/01/2011,185,"Invoice-Private",,09/01/2011,09/10/2011,,50113606MO,-5860.0000,,,,,,,,,,
TRANSACTION,3260,010209501,1,30,30,"Credit for Monthly Cable: Erickson, Dorothy",,,,,,,,,,,,,,,
TRANSACTION,3320,010209501,30,4,120,"Limited Term Discount: Erickson, Dorothy",,,,,,,,,,,,,,,
TRANSACTION,3130,010209501,1,35,35,"Credit for Pendant Fee: Erickson, Dorothy",,,,,,,,,,,,,,,
