BATCH,,201304,B,130.0000,
INVOICE,IN,,50110268,,04/01/2013,65.0000,"Invoice-Private",,04/01/2013,04/10/2013,,50114591MO,-3210.0000,,,,,,,,,,
TRANSACTION,3260,010209501,1,30.0000,30.00,"Monthly Cable: Toone, Donna",,,,,,,,,,,,,,,
TRANSACTION,3130,010209501,1,35.0000,35.00,"Pendant Fee: Toone, Donna",,,,,,,,,,,,,,,
INVOICE,CM,,50110268,,04/01/2013,65,"Invoice-Private",,04/01/2013,04/10/2013,,50114591MO,-3210.0000,,,,,,,,,,
TRANSACTION,3260,010209501,1,30,30,"Credit for Monthly Cable: Toone, Donna",,,,,,,,,,,,,,,
TRANSACTION,3130,010209501,1,35,35,"Credit for Pendant Fee: Toone, Donna",,,,,,,,,,,,,,,
