BATCH,,201111,B,3069.0000,
INVOICE,IN,,10910219,,11/22/2011,3069.0000,"MoveIn-Pletcher. Patricia",,11/22/2011,11/22/2011,,10914478,6690.0000,,,,,,,,,,
TRANSACTION,3010,010305109,9,100.0000,900,"Basic Service Fee- One Bedroom Prem: Pletcher. Patricia",,,,,,,,,,,,,,,
TRANSACTION,3017,010305109,9,16.0000,144,"Resident Care - Level 1: Pletcher. Patricia",,,,,,,,,,,,,,,
TRANSACTION,3260,010305109,1,25.0000,25,"Monthly Cable: Pletcher. Patricia",,,,,,,,,,,,,,,
TRANSACTION,3216,010305109,1,2000.0000,2000,"New Resident Fee: Pletcher. Patricia",,,,,,,,,,,,,,,
