BATCH,,201109,B,170.0000,
INVOICE,IN,,03210197,,09/01/2011,85.0000,"Invoice-Private",,09/01/2011,09/10/2011,,03214547MO,-2688.0000,,,,,,,,,,
TRANSACTION,3260,010202032,1,25.0000,25.00,"Monthly Cable: Beinhorn, Linda",,,,,,,,,,,,,,,
TRANSACTION,3320,010202032,30,2.0000,60.00,"Credit for Limited Term Discount: Beinhorn, Linda",,,,,,,,,,,,,,,
INVOICE,CM,,03210197,,09/01/2011,85,"Invoice-Private",,09/01/2011,09/10/2011,,03214547MO,-2688.0000,,,,,,,,,,
TRANSACTION,3260,010202032,1,25,25,"Credit for Monthly Cable: Beinhorn, Linda",,,,,,,,,,,,,,,
TRANSACTION,3320,010202032,30,2,60,"Limited Term Discount: Beinhorn, Linda",,,,,,,,,,,,,,,
