BATCH,,201108,B,2220.0000,
INVOICE,IN,,04310162,,08/01/2011,1110.0000,"Invoice-Private",,08/01/2011,08/10/2011,,04313644MO,-4984.0000,,,,,,,,,,
TRANSACTION,3260,010202043,1,25.0000,25.00,"Monthly Cable: Chenault, John",,,,,,,,,,,,,,,
TRANSACTION,3320,010202043,31,35.0000,1085.00,"Credit for Limited Term Discount: Chenault, John",,,,,,,,,,,,,,,
INVOICE,CM,,04310162,,08/01/2011,1110,"Invoice-Private",,08/01/2011,08/10/2011,,04313644MO,-4984.0000,,,,,,,,,,
TRANSACTION,3260,010202043,1,25,25,"Credit for Monthly Cable: Chenault, John",,,,,,,,,,,,,,,
TRANSACTION,3320,010202043,31,35,1085,"Limited Term Discount: Chenault, John",,,,,,,,,,,,,,,
