BATCH,,201201,B,90.0000,
INVOICE,IN,,14910124,,01/01/2012,45.0000,"Invoice-Private",,01/01/2012,01/10/2012,,14914473MO,-2664.9000,,,,,,,,,,
TRANSACTION,3260,010212149,1,30.0000,30.00,"Monthly Cable: Crane, Evelyn",,,,,,,,,,,,,,,
TRANSACTION,3316,010212149,1,15.0000,15.00,"Credit for Employee Discount: Crane, Evelyn",,,,,,,,,,,,,,,
INVOICE,CM,,14910124,,01/01/2012,45,"Invoice-Private",,01/01/2012,01/10/2012,,14914473MO,-2664.9000,,,,,,,,,,
TRANSACTION,3260,010212149,1,30,30,"Credit for Monthly Cable: Crane, Evelyn",,,,,,,,,,,,,,,
TRANSACTION,3316,010212149,1,15,15,"Employee Discount: Crane, Evelyn",,,,,,,,,,,,,,,
