BATCH,,201306,B,4790.0000,
INVOICE,IN,,53010280,,06/21/2013,4790.0000,"MoveIn-Frederick. Jerome",,06/21/2013,06/21/2013,,53016950,10069.0000,,,,,,,,,,
TRANSACTION,3010,010319530,10,125.0000,1250,"One Bedroom Premium w/Patio: Frederick. Jerome",,,,,,,,,,,,,,,
TRANSACTION,3017,010319530,10,44.0000,440,"Resident Care - Level 2: Frederick. Jerome",,,,,,,,,,,,,,,
TRANSACTION,3260,010319530,1,40.0000,40,"Monthly Cable: Frederick. Jerome",,,,,,,,,,,,,,,
TRANSACTION,3216,010319530,1,3000.0000,3000,"New Resident Fee: Frederick. Jerome",,,,,,,,,,,,,,,
TRANSACTION,3260,010319530,1,40.0000,40,"Monthly Cable: Frederick. Jerome",,,,,,,,,,,,,,,
TRANSACTION,3130,010319530,1,20.0000,20,"Pendant Fee: Frederick. Jerome",,,,,,,,,,,,,,,
