BATCH,,201209,B,2165.0000,
INVOICE,IN,,18910317,,09/26/2012,2165.0000,"MoveIn-Fosdick. Joyce",,09/26/2012,09/26/2012,,18915457,6158.0000,,,,,,,,,,
TRANSACTION,3010,010315189,5,118.0000,590,"Basic Service Fee- One Bedroom Prem: Fosdick. Joyce",,,,,,,,,,,,,,,
TRANSACTION,3260,010315189,1,25.0000,25,"Monthly Cable: Fosdick. Joyce",,,,,,,,,,,,,,,
TRANSACTION,3216,010315189,1,1500.0000,1500,"New Tenant Fee: Fosdick. Joyce",,,,,,,,,,,,,,,
TRANSACTION,2094,010315189,5,10.0000,50,"CC Meals: Fosdick. Joyce",,,,,,,,,,,,,,,
