BATCH,,201105,B,3025.0000,
INVOICE,IN,,18910275,,05/17/2011,3025.0000,"MoveIn-Keith. William",,05/17/2011,05/17/2011,,18914700,3025.0000,,,,,,,,,,
TRANSACTION,3010,010315189,15,90.0000,1350,"W.Keith: Basic Service Fee- Studio Premium: Keith. William",,,,,,,,,,,,,,,
TRANSACTION,3260,010315189,1,25.0000,25,"Monthly Cable: Keith. William",,,,,,,,,,,,,,,
TRANSACTION,3216,010315189,1,1500.0000,1500,"New Tenant Fee: Keith. William",,,,,,,,,,,,,,,
TRANSACTION,3241,010315189,15,10.0000,150,"HSG Meals: Keith. William",,,,,,,,,,,,,,,
