BATCH,,201107,B,3445.0000,
INVOICE,IN,,18910278,,07/12/2011,3445.0000,"MoveIn-Denbrock. John",,07/12/2011,07/12/2011,,18914787,3445.0000,,,,,,,,,,
TRANSACTION,3010,010315189,20,86.0000,1720,"J.Denbrock: Basic Service Fee - Studio: Denbrock. John",,,,,,,,,,,,,,,
TRANSACTION,3260,010315189,1,25.0000,25,"Monthly Cable: Denbrock. John",,,,,,,,,,,,,,,
TRANSACTION,3216,010315189,1,1500.0000,1500,"New Tenant Fee: Denbrock. John",,,,,,,,,,,,,,,
TRANSACTION,2094,010315189,20,10.0000,200,"CC Meals: Denbrock. John",,,,,,,,,,,,,,,
