BATCH,,201210,B,5338.0000,
INVOICE,IN,,18910318,,10/01/2012,5338.0000,"MoveIn-Carr. Wilma",,10/01/2012,10/01/2012,,18915461,5338.0000,,,,,,,,,,
TRANSACTION,3010,010315189,31,113.0000,3503,"Basic Service Fee - One Bedroom: Carr. Wilma",,,,,,,,,,,,,,,
TRANSACTION,3260,010315189,1,25.0000,25,"Monthly Cable: Carr. Wilma",,,,,,,,,,,,,,,
TRANSACTION,3216,010315189,1,1500.0000,1500,"New Tenant Fee: Carr. Wilma",,,,,,,,,,,,,,,
TRANSACTION,2094,010315189,31,10.0000,310,"CC Meals: Carr. Wilma",,,,,,,,,,,,,,,
