BATCH,,201208,B,3370.0000,
INVOICE,IN,,18910314,,08/17/2012,3370.0000,"MoveIn-Young. Raymond",,08/17/2012,08/17/2012,,18915409,7085.0000,,,,,,,,,,
TRANSACTION,3010,010315189,15,113.0000,1695,"Basic Service Fee - One Bedroom: Young. Raymond",,,,,,,,,,,,,,,
TRANSACTION,3260,010315189,1,25.0000,25,"Monthly Cable: Young. Raymond",,,,,,,,,,,,,,,
TRANSACTION,3216,010315189,1,1500.0000,1500,"New Tenant Fee: Young. Raymond",,,,,,,,,,,,,,,
TRANSACTION,2094,010315189,15,10.0000,150,"CC Meals: Young. Raymond",,,,,,,,,,,,,,,
