BATCH,,201106,B,204.0000,
INVOICE,IN,,14710203,,06/01/2011,102.0000,"Invoice-Private",,06/01/2011,06/10/2011,,14715098MO,-2035.0000,,,,,,,,,,
TRANSACTION,3260,010310147,1,42.0000,42.00,"Monthly Cable: Jeffries, Jane",,,,,,,,,,,,,,,
TRANSACTION,3320,010310147,30,2.0000,60.00,"Credit for Limited Term Discount: Jeffries, Jane",,,,,,,,,,,,,,,
INVOICE,CM,,14710203,,06/01/2011,102,"Invoice-Private",,06/01/2011,06/10/2011,,14715098MO,-2035.0000,,,,,,,,,,
TRANSACTION,3260,010310147,1,42,42,"Credit for Monthly Cable: Jeffries, Jane",,,,,,,,,,,,,,,
TRANSACTION,3320,010310147,30,2,60,"Limited Term Discount: Jeffries, Jane",,,,,,,,,,,,,,,
