BATCH,,201206,B,6880.0000,
INVOICE,IN,,07310231,,06/01/2012,6880.0000,"MoveIn-Richter. June",,06/01/2012,06/01/2012,,07315590,6880.0000,,,,,,,,,,
TRANSACTION,3010,010305073,30,129.0000,3870,"J.Richter: Basic Service Fee - One Bedroom: Richter. June",,,,,,,,,,,,,,,
TRANSACTION,3017,010305073,30,33.0000,990,"J.Richter: Resident Care - Level 2: Richter. June",,,,,,,,,,,,,,,
TRANSACTION,3260,010305073,1,20.0000,20,"Monthly Cable: Richter. June",,,,,,,,,,,,,,,
TRANSACTION,3216,010305073,1,2000.0000,2000,"New Resident Fee: Richter. June",,,,,,,,,,,,,,,
