BATCH,,201804,B,4549.7300,
INVOICE,IN,,31300041,,04/04/2018,4549.7300,"MoveIn-Richards. Mary",,04/04/2018,04/04/2018,,31310629,4549.7300,,,,,,,,,,
TRANSACTION,3010,070024313,27,67.0000,1809,"Companion One Bedroom: Richards. Mary",,,,,,,,,,,,,,,
TRANSACTION,3216,070024313,1,2036.8000,2036.8,"Community Fee: Richards. Mary",,,,,,,,,,,,,,,
TRANSACTION,3260,070024313,1,25.0000,25,"Monthly Cable: Richards. Mary",,,,,,,,,,,,,,,
TRANSACTION,3216,070024313,1,678.9300,678.93,"Monthly Deferral Charge: Richards. Mary",,,,,,,,,,,,,,,
