BATCH,,201801,B,6308.0000,
INVOICE,IN,,53010107,,01/01/2018,6308.0000,"MoveIn-Jindra. David",,01/01/2018,01/01/2018,,53021196,11972.0000,,,,,,,,,,
TRANSACTION,3010,010019530,31,96.0000,2976,"Basic Service Fee-One Bedroom Premium: Jindra. David",,,,,,,,,,,,,,,
TRANSACTION,3216,010019530,1,2000.0000,2000,"Community Fee: Jindra. David",,,,,,,,,,,,,,,
TRANSACTION,3216,010019530,1,666.0000,666,"Monthly Deferral Charge: Jindra. David",,,,,,,,,,,,,,,
TRANSACTION,3216,010019530,1,666.0000,666,"Monthly Deferral Charge: Jindra. David",,,,,,,,,,,,,,,
