BATCH,,201304,B,584.6000,
INVOICE,IN,,12410235,,04/01/2013,292.3000,"Invoice-Private",,04/01/2013,04/10/2013,,12415239MO,-1484.9000,,,,,,,,,,
TRANSACTION,3260,010211124,1,35.0000,35.00,"Monthly Cable: Hinken, Clara",,,,,,,,,,,,,,,
TRANSACTION,3312,010211124,1,8.3000,8.30,"Credit for Two Room Rental Discount: Hinken, Clara",,,,,,,,,,,,,,,
TRANSACTION,3312,010211124,30,8.3000,249.00,"Credit for Two Room Rental Discount: Hinken, Clara",,,,,,,,,,,,,,,
INVOICE,CM,,12410235,,04/01/2013,292.3,"Invoice-Private",,04/01/2013,04/10/2013,,12415239MO,-1484.9000,,,,,,,,,,
TRANSACTION,3260,010211124,1,35,35,"Credit for Monthly Cable: Hinken, Clara",,,,,,,,,,,,,,,
TRANSACTION,3312,010211124,1,8.3,8.3,"Two Room Rental Discount: Hinken, Clara",,,,,,,,,,,,,,,
TRANSACTION,3312,010211124,30,8.3,249,"Two Room Rental Discount: Hinken, Clara",,,,,,,,,,,,,,,
